Artista,Biografia,Listeners,Playcount,Artistas Similares
Disclosure,"Disclosure are Guy Lawrence and Howard Lawrence, brothers from Surrey, United Kingdom. Crafting their own lo-fi dream-dub sound, Disclosure effortlessly combine 2-step garage rhythms and dubstep basslines with their own rich musical heritage of soul, jazz and 90s hip hop. After their debut single on Moshi-Moshi Records in September 2010, the duo released a 4 track EP on Transparent Records the year after. 2012 saw the release of ""Tenderly/Flow"" and ""The Face"" EP on Greco-Roman. <a href=""https://www.last.fm/music/Disclosure"">Read more on Last.fm</a>",1957558,60525426,AlunaGeorge
Year of Dogs," <a href=""https://www.last.fm/music/Year+of+Dogs"">Read more on Last.fm</a>",2995,13636,aboynamedblu
Durante,"Passion is the artist’s calling card, no matter the medium, and that’s a truth Kevin Durante recognizes above all else. His music has clutched the attention of listeners globally via releases on a multitude of international record labels including Anjunadeep, W&O Street Tracks, Earthly Delights, Nice Age, and Openers. Perhaps his Italian roots push the producer/DJ to seek a higher beauty, but with more than a decade of creation, experimentation, and discovery behind him, his personal journey has taught him not to fear honesty.  <a href=""https://www.last.fm/music/Durante"">Read more on Last.fm</a>",102642,775694,Rezident
DØBER," <a href=""https://www.last.fm/music/D%C3%98BER"">Read more on Last.fm</a>",3621,19139,BLVNCO
Spada,"Once again Italy brings some refreshing new artists and sounds this year with minimal producer spada leading the way. Combining minimal percussion with an exciting melancholic sound that cuts through like a razor this Ace of Spades has been releasing some seriously quality stuff with support by Boys Noize, Umek, Satoshi Tomiee, Sasha, Armin Van Bureen, Oscar, Audiofly, Dj Yellow, Da Fresh, Lars Sommerfeld, Davis&May, Ron Flatter etc... with releases on labels like Boxer Sport, Maripoza, Back Home, Manual music, KarateKlub. <a href=""https://www.last.fm/music/Spada"">Read more on Last.fm</a>",143857,951475,Daniel Portman
Ben Remember," <a href=""https://www.last.fm/music/Ben+Remember"">Read more on Last.fm</a>",13935,45783,TUFF LONDON
Muzzaik,"Real Name: Dániel Dalmady & Zsolt Milichovszki 
Profile: As DJs both of them represent the same style, that's how they've met. Muzzaik project was formed in 2002 by Dalmady Daniel and Milichovszki Zsolt. The goal was to create something enduring within House style and to share their special sounding with people. Their first production was released in the spring of 2003 with the title: Tribalground EP. They are not only interested in tribal-house <a href=""https://www.last.fm/music/Muzzaik"">Read more on Last.fm</a>",33911,107002,Vandalism & Angger Dimus
Freak On," <a href=""https://www.last.fm/music/Freak+On"">Read more on Last.fm</a>",9635,37130,Chaney
D.O.D,"There are 3 types of D.O.D.  the first is Do or Die a four piece band from San Francisco, comprising of two women and two men who are no longer playing together. 

The Second is Duo of Darkness a three piece band from Groningen; The Netherlands comprising of three friends rhymin' their way to the top. (www.last.fm/music/duo+of+darkness)

The third is is a British house music DJ & Producer, D.O.D <a href=""https://www.last.fm/music/D.O.D"">Read more on Last.fm</a>",264613,3329928,Noizu
Pax,"There are at least eight different artists with the name PAX:

1) A Peruvian psychedelic rock band from the 1970s, now split-up. Members included: Mark Aguilar, Enrique Ego Aguirre, Miguel Flores, and Jaime Orue Moreno. They released one full length album, Pax (May God And Your Will Land You And Your Soul Miles Away From Evil) in 1970 by Sono Radio. Also a number of 45rpm singles through the '70s to the mid '80s including Exorcismo / Sr. Epidermis and Radar of Love. <a href=""https://www.last.fm/music/Pax"">Read more on Last.fm</a>",113980,642438,Traffic Sound
Bassel Darwish,"Bassel Darwish was born in Barcelona, Spain. He performed in Countries like: Spain, Greece, USA, México, UK, Egypt, Argentina, Brazil, Panamá, Costa Rica, Croatia, Germany, Italy, Malaysia, Thailand, Chile, Lebanon, Bulgaria, Ecuador. 

He is now focusing on producing Tech House music, to share his passion with the world. His musical talent in production led him to be part of labels such as: Solid Grooves, Stereo Productions, Deeperfect, Material, Moan, NoExcuse, Lemon-aid, SK and more.  <a href=""https://www.last.fm/music/Bassel+Darwish"">Read more on Last.fm</a>",4084,13863,Bizen Lopez
Rendher,"Tras 6 años de carrera en Elefante -una de las bandas más importantes del rock en Uruguay con 3 discos editados: elefante 1 (1999), bazar (2001) y Forma (2002), Stella Maris, Maneco y Harry, dan comienzo a un nuevo proyecto llamado RENDHER. La nueva propuesta fluye entre el rock y el sofisticado pop electrónico mostrando una química más evolucionada entre sus integrantes reflejada en sus temas. <a href=""https://www.last.fm/music/Rendher"">Read more on Last.fm</a>",1762,7300,Miss Wichita
Sam Collins,"Sam Collins (August 11, 1887 - October 20, 1949),
Crying Sam Collins was an early American blues singer and guitarist.
Aka Jim Foster, Jelly Roll Hunter, Big Boy Woods, Bunny Carter, and Salty Dog Sam.

He was born in Louisiana and grew up just across the state border in McComb, Mississippi. By 1924 he was performing in local barrelhouses, often with King Solomon Hill with whom
 he shared the use of falsetto singing and slide guitar. He was first recorded by Gennett Records <a href=""https://www.last.fm/music/Sam+Collins"">Read more on Last.fm</a>",28716,131532,Blind Lemon Jefferson
Low Steppa,"Low Steppa is without doubt one of the most vital and influential house music artists of the present day. From his explosive bootleg of Route 94's 'My Love' to playing BBC Radio 1's Big Weekend and Defected In The House parties, to his Rinse FM show and all-conquering Simma Black imprint - which celebrated its 100th release in 2017 - Low Steppa is about as relevant and in-demand a DJ and producer as its possible to be.

It was the aforementioned bootleg of Route 94's 'My Love' that announced his arrival, reaching over 2. <a href=""https://www.last.fm/music/Low+Steppa"">Read more on Last.fm</a>",108404,679007,Illyus & Barrientos
marsh,"There are two artists with the name of Marsh. For the black metal one, go here: Mἄrsh. 

Marsh - British Progressive House Producer. Tom Marshall

Following his debut ‘You’ll Be Fine’ released on Silk Music’s Arrival imprint in June 2012, half a year was all it took for the UK’s Tom Marshall, aka. Marsh to gain the spotlight amongst many electronic dance music stars.

Recognised for his high energy grooves, pulsating beats and endorphin inducing melodies <a href=""https://www.last.fm/music/marsh"">Read more on Last.fm</a>",85072,1212630,
Tinlicker,"Utrecht based duo Micha Heyboer and Jordi van Achthoven have been crafting their computerized soul together since 2013. And even during those early days they were no rookies, having individually honed their skills as part of world renowned drum 'n bass act Black Sun Empire (Heyboer) and as producer, songwriter and music editor for many artists (Van Achthoven).

All this previous experience showed from day one, resulting in an impressive string of highly mature and deeply emotive tracks. <a href=""https://www.last.fm/music/Tinlicker"">Read more on Last.fm</a>",320358,4208604,Massane
Eli Brown,"Eli Brown has rapidly established himself as an artist of real distinction in the house world, with his records making an immediate impact upon a flurry of the industry’s biggest names. Having grown up in Bristol, Eli Brown was exposed to a rich array of different musical influences from Jungle to Rave music, form Drum n’ Bass to House. Bristol’s musical heritage has helped define Eli Brown’s sound in an overcrowded House Music scene where he stands out from the rest. <a href=""https://www.last.fm/music/Eli+Brown"">Read more on Last.fm</a>",178995,1656354,Lilly Palmer
Proudly People," <a href=""https://www.last.fm/music/Proudly+People"">Read more on Last.fm</a>",5866,18382,Italobros
BT,"Brian Transeau (born Brian Wayne Transeau on October 4, 1971, in Rockville, Maryland) is an American musician who records under the stage name BT. Classically trained from the age of 13, he attended Berklee College of Music in Boston for one year before dropping out and moving to Los Angeles, California, and then back to Washington, D.C..

From an early age, BT demonstrated a remarkable aptitude for playing and understanding classical music. He was heavily influenced by avant-garde and romantic composers such as Stravinsky <a href=""https://www.last.fm/music/BT"">Read more on Last.fm</a>",610224,10810409,Chicane
Sacha Robotti," <a href=""https://www.last.fm/music/Sacha+Robotti"">Read more on Last.fm</a>",13361,52993,Billy Kenny
Chris Lake,"Globally recognised as one of the most exciting, forward thinking and cutting edge producers on the scene, Chris Lake's rare ability to create tracks that fuse elements of house, electro and techno has not been lost on his fellow peers. His innovative productions continue to receive wave after wave of support from such luminaries that include Sasha, Danny Howells, Justin Robertson, Sander Kleinenberg and Carl Cox, whilst Pete Tong leads the way in championing the unique sound that has established Chris as one of the world's elite. <a href=""https://www.last.fm/music/Chris+Lake"">Read more on Last.fm</a>",598315,5880061,Fisher
San Pacho,"Born and raised in Croatia, San Pacho is a young, hungry house artist who keeps making the right moves at the right time. After launching the project only 3 years ago in 2019, he’s signed songs to Confession, UKF, Dim Mak, and others. His releases are commonly incorporated with genres such as tech house / club house, all of which hits a sweet spot that is hard to directly describe. 

Artists like Tchami, 4B, Wax Motif and dozens of other staple DJ’s can’t get enough of it, giving it their nod of approval and thus their support.  <a href=""https://www.last.fm/music/San+Pacho"">Read more on Last.fm</a>",50275,326399,Black V Neck
EDX,"EDX is a worldwide acclaimed remixer, well known for his brilliant work for the likes of Dubfire, Deadmau5, Armand van Helden, Steve Angello, Sucker DJs, Michael Procter, Kool & The Gang, Lauryn Hill, Kaskade and Armin van Buuren, to name but a few.
Enormous Diverse Xample (of a genius) might not be an accurate, but for sure a possible interpretation of the three letters EDX. Productive and successful for more then a decade, Italian native artist <a href=""https://www.last.fm/music/EDX"">Read more on Last.fm</a>",253455,2257185,Michael Calfan
Dusky,"Previously existing as progressive / melodic house entity Solarity, Dusky are London based musicians Alfie Granger-Howell and Nick Harriman. As comfortable writing elegant orchestral pieces or stirring piano motifs as they are jackin' house and epic techno grooves, their diverse sounds are united by the duo's singular aim - to compose electronic music with depth, soul and originality. <a href=""https://www.last.fm/music/Dusky"">Read more on Last.fm</a>",200995,2122324,Universal Solution
Chapter & Verse," <a href=""https://www.last.fm/music/+noredirect/Chapter+&+Verse"">Read more on Last.fm</a>",47145,259174,
,,,,
Martin Ikin,"DJ’ing since 1990 and Producing music since 1991, Martin Ikin previously known as; DJ Mayhem, Indigo, Soul Purpose, Migrant.. and loads more, has spent his life releasing records on many labels and under many aliases. Including, Defected, Nervous, OFF, Get Physical, Exploited, Zrecords, 3Beat, MOS, SwingCity, Hed Kandi, Soulfuric, Sony, Island, Atlantic..etc etc.

Martin's remix credentials include names such as Mariah Carey, Jamiroquai, Joey Negro, MAW, Grant Nelson, Hardsoul and many more...  <a href=""https://www.last.fm/music/Martin+Ikin"">Read more on Last.fm</a>",99806,631060,Biscits
Cloverdale," <a href=""https://www.last.fm/music/Cloverdale"">Read more on Last.fm</a>",13766,62522,dont blink
CamelPhat,"Multi-platinum DJ and production duo Dave Whelan and Mike Di Scala, better known as CamelPhat, have enjoyed a meteoric rise to the top of the dance music world since breaking through with global hit ‘Cola’ in 2017.

The Grammy and Ivor Novello-nominated pair from Liverpool have continued to evolve their sound, releasing a slew of hits, and becoming one of Beatport’s biggest-selling artists of all time. Their acclaimed and silver-certified debut album ‘Dark Matter’ is packed with high-profile collaborations <a href=""https://www.last.fm/music/CamelPhat"">Read more on Last.fm</a>",470539,5777896,Franky Wah
MNNR,"Hailing from Italy, MNNR is the freshman of the upcoming basshouse scene. From the likes of Tchami, Malaa is part of the Confession family. His unique sound design charmes the one and only AC Slater becoming one of the main names of his collective, Night Bass. He also released on labels like CID's Night Service Only, Insomniac's IN/Rotation, Jauz' Bite This and Botnek's WFHQ

Wherever you are, EDC, Ultra or Tomorrowland you will hear MNNR music played by main artists of the scene, teaching you bad MNNRs. <a href=""https://www.last.fm/music/MNNR"">Read more on Last.fm</a>",8290,42211,Keeld
Gorgon City,"Gorgon City are two North London producers individually known as Foamo and RackNRuin.

Taking up residence on Black Butter Records, their February 2012 debut collaboration ""The Crypt EP"" featured NAVIGATOR, RUBI DAN and JANAI.

One year later, they joined forces with Yasmin for the lead track of the ""Real EP"", ""Real (feat. Yasmin)"", gaining support on both the dancefloor and airwaves. ""Intentions (feat. Clean bandit)"" with Nikki B on vocals and backed by ""Cycles"" , were released on May 2013. <a href=""https://www.last.fm/music/Gorgon+City"">Read more on Last.fm</a>",559457,7961813,Duke Dumont
Tensnake,"Tensnake is Marco Niemerski. Born in Hamburg in 1975, Marco grew up listening to disco, soul, boogie, funk, 80s pop and Balearic. His older brother introduced him to a more dancefloor-inspired influences from Larry Levan to Junior Boys Own, Romanthony to Masters of Work.

He founded the label Mirau in 2005 but Tensnake’s first taste of critical acclaim came with the release of In the End (I Want You to Cry EP) on the label Running Back in 2009. The EP was voted number one on djhistory.com’s end-of-the-year list. <a href=""https://www.last.fm/music/Tensnake"">Read more on Last.fm</a>",338236,3231214,Purple Disco Machine
Grum,"Real Name: Graeme Shepherd.

Scottish Electro/ Disco House/ French Pop artist from Leeds, UK.

His debut album 'Heartbeats' was released on 17 May 2010 on Heartbeats Music. This was preceded by the lead single ""Can't Shake This Feeling"" on 7 May 2010.

He has also released EPs titled Runaway, Heartbeats and Sound Reaction.

He names his main influences as The Human League and Daft Punk.

Shepherd grew up in Linlithgow, near Edinburgh and then moved to Leeds in 2004 to study a Music Technology course in nearby Huddersfield. <a href=""https://www.last.fm/music/Grum"">Read more on Last.fm</a>",231765,3141396,Eli & Fur
Ben Böhmer,"ENG   
Ben's childhood was minted by musical fulfillment through learning the piano, the trumpet and growing up under the influence of many different musical genres. It wasn't until years later, that he came to electronic music through experiments with synthesizers and became a producer.His live sets are an absolute highlight as he improvises around his own productions which have appeared on such esteemed labels as Anjunadeep, Sacrebleu, Audiolith or Keller Rec. <a href=""https://www.last.fm/music/Ben+B%C3%B6hmer"">Read more on Last.fm</a>",247267,4522575,Lane 8
CRI,"CRi, aka Christophe Dubé, is a significant player in the Montreal electronic scene with his distinctive sonic palette characterized by pulsating house synths, intricate syncopated snares, and forward-thinking basslines. As a self-taught college dropout, CRi gained recognition with his EPs 'Tell Her' and 'Someone Else' on Young Art, TOKiMONSTA's label. His breakthrough came in 2018 with a Juno nomination and the release of the mini EP 'Me and My Friends. <a href=""https://www.last.fm/music/CRI"">Read more on Last.fm</a>",113607,1047429,
SBTRKT,"SBTRKT (pronounced ""subtract"") is the electronic music project of Aaron Jerome, a producer based in London. Initially know for the tribal masks he and his collaborators wore in their live performances, Jerome shed the masks in the run-up to this fourth album, ""The Rat Road."" 

SBTRKT debuted in 2009 with remixes of artists like Radiohead, M.I.A, Basement Jaxx (‘Scars’) and Franz Ferdinand (‘Send Him Away’). These remixes gained the attention of radio DJs and tastemaker blogs, leading to more releases on Brainmath label, Ramp and Young. <a href=""https://www.last.fm/music/SBTRKT"">Read more on Last.fm</a>",839850,22428994,SBTRKT & Sampha
Sweet Knives," <a href=""https://www.last.fm/music/Sweet+Knives"">Read more on Last.fm</a>",856,8570,River City Tanlines
Anti Up,"Never established. Never limited. Keep calm? Says who? Chris Lake x Chris Lorenzo <a href=""https://www.last.fm/music/Anti+Up"">Read more on Last.fm</a>",65255,430574,Cloonee
Tsha,"Tsha (full name: Teisha Matthews) is a Fareham born and London, (United Kingdom) based producer of electronic music, mostly house-with-vocals. Following the Moonlight (2019), Flowers (2020) and OnlyL (2021) EPs, she released her full-length début album, Capricorn Sun in October 2022. <a href=""https://www.last.fm/music/Tsha"">Read more on Last.fm</a>",179631,1476589,Barry Can't Swim
Kyle Watson,"Kyle has been involved in music his whole life, attending piano lessons for 8 years and taking music as a subject while he was at school. He has been brought up with music running through his blood; a fascination with electronic music production was imminent.

The immense interest he has in the production of house began a few years back when he got his hands on an early version of Dance eJay. He played around with the program for 3 or 4 years, but yearned to have the power to produce his own music from scratch. <a href=""https://www.last.fm/music/Kyle+Watson"">Read more on Last.fm</a>",111283,738750,The First Station
Dot N Life," <a href=""https://www.last.fm/music/Dot+N+Life"">Read more on Last.fm</a>",7263,28207,Kyle Walker
Apparel Wax,"Apparel Wax is the code name of an unknown artist, brought to life by a collective of many talented international ghost producers who pull its strings, giving him life with their sounds. It’s the newest creation and it symbolizes our love for music, the only thing we really care about, without compromises or distinction. The main ingredient of Wax’s recipe is quality, not names! <a href=""https://www.last.fm/music/Apparel+Wax"">Read more on Last.fm</a>",14395,69438,Jason Hersco
Jerro,"Hailing from Hasselt, Belgium, Jeroen Decosemaker is a rising producer specializing in melodic house and downtempo electronic music; the creative mind behind the Jerro project. He received a proper introduction to the world in late 2018, having multiple tracks featured on Lane 8's 'Root to Branch, Vol. 3' compilation. In early 2019, Jerro released his debut EP 'The Fool', once again via Lane 8's This Never Happened record label. The package quickly <a href=""https://www.last.fm/music/Jerro"">Read more on Last.fm</a>",89992,827621,Ben Böhmer
Tough Love,"1) London based duo Tough Love  have been at the forefront of the house scene for sometime now since they started out in 2011. Their distinct production, together with energetic and bass-heavy DJ sets, has created a cult following of hard-core fans across the UK and beyond. 

Their sound is instantly recognisable in their production hard-hitting grooves accompanied by crisp drum layers & undeniable dancability. It’s this infectious sound that won <a href=""https://www.last.fm/music/Tough+Love"">Read more on Last.fm</a>",103118,507935,Kideko
Cristoph,"There’s a new titan in the world of progressive house, and his name is Cristoph. The mysterious producer has proven himself a bona fide force to be reckoned with landmark releases on imprints like Last Night on Earth and Bedrock. Now, with the official backing of Eric Prydz, he’s primed for even greater success. It’s no surprise his music has caught on so fervently: simply put, Cristoph’s sound is infectious.
 
Cristoph hails from Newcastle upon Tyne, coming from a family deeply entrenched in the art of DJing. <a href=""https://www.last.fm/music/Cristoph"">Read more on Last.fm</a>",112158,893597,CamelPhat
Linkwood,"Linkwood is Producer, Engineer and DJ Nick Moore. 
Best known for his highly acclaimed releases on Firecracker Records, including 'Miles Away' and 'Piece of Mind', Linkwood released his first LP ‘System’ for Prime Numbers in September 2009 - an album which has taken him around the world. 
As a teenager growing up in Bristol in the late 80’s/early 90’s, Linkwood became fascinated with house and techno. This inspired him to make his own music and learn everything possible about production and recording techniques. <a href=""https://www.last.fm/music/Linkwood"">Read more on Last.fm</a>",47198,350315,Move D
Lucati,"Music over everything. That is the motto that has propelled LUCATI's music to the worlds largest stages. Garnering the support from House music legends such as Claude Von Stroke, Dennis Ferrer, Green Velvet, Chris Lake, Lee Foss and countless others has brought this House music producer straight from the underground, to the big show. No stranger to festivals either, LUCATI has smashed EDC Las Vegas, EDC Mexico, HARD Summer, Audiotistic, Countdown NYE, and more. <a href=""https://www.last.fm/music/Lucati"">Read more on Last.fm</a>",7034,24150,Ranger Trucco
House on the Moon," <a href=""https://www.last.fm/music/House+on+the+Moon"">Read more on Last.fm</a>",7,20,
DREZO,"Based in Los Angeles, Drezo is no outsider to the underground sound that is currently sweeping across the restless west coast city. Through his compositions and remixes, the 23 year old aims to represent the darker and more imaginative side of house music. Using influences from the LA scene has shaped this young artist’s music into a surge of haunting originality that is instantly recognizable. Currently being championed by some of the main tastemakers in the game <a href=""https://www.last.fm/music/DREZO"">Read more on Last.fm</a>",29675,204930,BROHUG
Lxury,"West London based artist and producer Andy Smith is better known as ""Lxury"", up-and-coming electronic talent.

The five smashing sounds yet released on his soundcloud leave no doubt concerning his potential to ignite the electronic scene. While an official release is very much awaited, we can't help but notice, among his other tracks, the single ""J.A.W.S"", co-produced by Disclosure, which illustrates the flavoursome mix between Smith's electronic and dance influences. <a href=""https://www.last.fm/music/Lxury"">Read more on Last.fm</a>",70516,476212,Ruze
Illyus & Barrientos,"Glasgow has always been a fertile breeding ground for house music. With countless internationally-renowned DJs hailing from the city, there is no shortage of world-class talent in the UK’s northern clubbing powerhouse. 

The latest duo to set dance oors alight in Glasgow and far beyond are Illyus & Barrientos. The pair have diverse origins – Barrientos has Chilean parents and was born in America, while Illyus grew up in Frankfurt after being born in Govan. <a href=""https://www.last.fm/music/Illyus+&+Barrientos"">Read more on Last.fm</a>",44811,234466,Wh0
House Mix 2021," <a href=""https://www.last.fm/music/House+Mix+2021"">Read more on Last.fm</a>",546,4212,Workout Music Gym
Heider,"Resident of Baltimore, MD / Dubstep,DnB, EDM DJ / Dubstep,electronica Producer / www.heiderbeats.com <a href=""https://www.last.fm/music/Heider"">Read more on Last.fm</a>",6603,25243,poolhaus
Colour Castle," <a href=""https://www.last.fm/music/Colour+Castle"">Read more on Last.fm</a>",12078,41194,George Sandler
Prospa,"Leeds-based electronic duo Harvey Blumler and Gosha Smith (aka Prospa) chart a course through classic house and rave-era dance music. Growing up, both Blumler and Smith were more interested in rock music, with the former taking up drums and the latter learning guitar. In their teenage years, they gained an interest in electronic music production: Blumler started out by crafting dubstep inspired beats, whilst Smith was intent on making jazz-infused hip hop. <a href=""https://www.last.fm/music/Prospa"">Read more on Last.fm</a>",90953,783655,Jasper Tygner
LP Giobbi,"Leah Chisholm aka LP Giobbi is a producer-DJ-music director-synth musician, born in Oregon and based in LA.

When she’s not collaborating or touring with the likes of Sofi Tukker, Jax Jones, Hotel Garuda or Autograf, she’s co-founding publishing companies and touring parties (Animal Talk Collective; Sofi Tukker's label), heading up a non-profit organization to address the lack of representation and equity in electronic music (FEMME HOUSE; with her friend & co-manager Lauren A. <a href=""https://www.last.fm/music/LP+Giobbi"">Read more on Last.fm</a>",168071,1327286,J. Worra
