Artista,Biografia,Listeners,Playcount,Artistas Similares
Klur," <a href=""https://www.last.fm/music/Klur"">Read more on Last.fm</a>",84346,578731,Polar Inc.
Avoure,"Ukrainian deep house dynamo, Avoure
Avoure made his advantageous emergence earlier this year alongside the This Never Happened life-giver himself, Lane 8, for their effervescent collaborative single, “Let Me.” U, it appears, has been a long while in the making–seeing as Lane 8 has repeatedly spliced offerings from the project into his recent seasonal mixes, as he has done to bolster a sundry of other burgeoning label talent as of late, most notably, with Khåen. <a href=""https://www.last.fm/music/Avoure"">Read more on Last.fm</a>",70761,635068,Lane 8
Kideko,"Brighton-hailing producer Kideko unleashed a huge club banger in the shape of Crank It, Woah! in 2016 which became a get out of jail card for DJ’s all over the worl for the whole of the summer and beyond. 

He has gathered critical acclaim and big support for his productions from Oliver Heldens, The Magician, Blonde, David Guetta, Fatboy Slim, Gorgon City, Danny Howard, Mistajam, Pete Tong and Annie Mac, who made Crank It her ‘Hottest Record In The World’…twice! <a href=""https://www.last.fm/music/Kideko"">Read more on Last.fm</a>",100507,512631,Tough Love
Solardo,"Hailing from Manchester, production duo Mark Richards & James Eliot, collectively known as Solardo, are continuing the city’s rich heritage in house music.The prolific duo’s meteoric rise is testament to their hard work in the studio and their infectious energy in the club. A slew of releases via imprints like Viva, and elrow helped rocket them to their first Beatport Number 1 with their breakthrough record on Hot Creations, ‘Tribesmen’. Since then <a href=""https://www.last.fm/music/Solardo"">Read more on Last.fm</a>",107112,713542,Mark Knight
joseph ray,"joseph ray is a deep house  artist from the UK <a href=""https://www.last.fm/music/joseph+ray"">Read more on Last.fm</a>",18608,140713,Marsh
Avante (UK)," <a href=""https://www.last.fm/music/Avante+(UK)"">Read more on Last.fm</a>",474,1636,Eddy M
Marco V,"From well-known tracks like 'Indicator', 'Simulated' and 'Godd' through to present-day productions such as 'Second Bite', 'More Than A Life Away' and 'Red Blue Purple', and his successful updates of widely regarded classics such as 'Café Del Mar' and 'Loops & Tings Relooped', Marco V's discography is considerably extensive. On the decks he develops his personal style, incorporating anything from electro to techno. Travel the globe and you'll be hard-pushed to find a major club that hasn’t served as his host. <a href=""https://www.last.fm/music/Marco+V"">Read more on Last.fm</a>",246276,1713744,Marcel Woods
Lar,"LAR, real name Matt Larden (formerly known as Matteblack) is a house music producer and DJ from the UK.

LAR came on to the scene in 2021 with his organic house release ""Flawed"" through Monstercat Silk. With only a short time in music production he has secured himself as someone to look out for in the near future. <a href=""https://www.last.fm/music/Lar"">Read more on Last.fm</a>",15999,82175,Cephas Azariah
PROFF,"Real Name: Vladimir Ershov (Владимир Ершов) is a progressive house DJ & producer from Moscow, Russia signed to a UK record label Anjunabeats/Anjunadeep.

PROFF's earlier releases include ""My Personal Summer"" which was featured on CD1 of Anjunabeats Vol.6 and ""Aguilas"" which has been played lately in numerous Above & Beyond dj sets and podcasts. 

He collaborated with his fellow countryman, Mango, to release the track ""5th in Blue"", which had two separate remixes from both artists. <a href=""https://www.last.fm/music/PROFF"">Read more on Last.fm</a>",63383,527838,Jaytech
Spencer Brown,"


Based in San Francisco, 24-year-old Spencer Brown creates forward-thinking dance music that defies quick-shifting industry trends, carving his fresh take on the progressive space by creating earworms that incorporate authenticity with accessibility.After Above & Beyond discovered Spencer through his graceful 2014 debut release “Chalice EP” on Avicii’s LE7ELS (garnering over 1.5 million listens), a string of successful EPs on their legendary Anjunabeats label led to his 2018 debut album “Illusion of Perfection <a href=""https://www.last.fm/music/Spencer+Brown"">Read more on Last.fm</a>",61520,877184,Tinlicker
Danny Howard," <a href=""https://www.last.fm/music/Danny+Howard"">Read more on Last.fm</a>",28165,111708,TUFF LONDON
Kidnap,"1.  Kidnap - Bollywood movie - Soundtrack of this film is composed by Pritam . Please check your tags. Thank you.

2. French punk from Blois. They were on the most important compilation ever: Welcome to 1984.

3. Kidnap Kid's new name. <a href=""https://www.last.fm/music/Kidnap"">Read more on Last.fm</a>",129740,1131533,Ben Böhmer
Lane 8,"San Francisco-based house producer Lane 8 (real name: Daniel Goldstein) made quite a splash when The Magician played his debut single, “Don’t Want You Back”, in the 23rd installment of the wildly popular Magic Tape series. The follow-up single, titled ‘Dusty’, surpassed all expectations, racking up diverse DJ support from the UK’s Jody Wisternoff and Kidnap Kid to California’s Viceroy and Geisha Twins. From there, a 3-track EP, reworks of Fleetwood Mac and Brandy <a href=""https://www.last.fm/music/Lane+8"">Read more on Last.fm</a>",324909,7432148,Le Youth
Classmatic,"Classmatic is a Brazilian DJ & Producer with strong influences from Hip Hop, Breaks, Acid and Chicago House bringing originality and something unique and energetic in his sounds. 

He has released tracks on labels such as: Solid Grooves Raw, Hottrax, Deeperfect and many more.. Supported by artist such as: Jamie Jones, The Martinez Brothers, Loco Dice, Michael Bibi
and many more! <a href=""https://www.last.fm/music/Classmatic"">Read more on Last.fm</a>",10959,64108,Cour T.
Alex Breitling," <a href=""https://www.last.fm/music/Alex+Breitling"">Read more on Last.fm</a>",17749,72029,L.GU.
House Music 2021," <a href=""https://www.last.fm/music/House+Music+2021"">Read more on Last.fm</a>",198,3056,Gym Motivation DJ Team
Junior Jack,"Vito Lucente, better known as Junior Jack, is a house music producer and DJ, born in Italy, but resident in Belgium. He is better known for the singles ""My Feeling"", ""Thrill Me (Such A Thrill)"", ""E Samba"", ""Stupidisco"" and ""Da Hype"", the latter featuring vocals by Robert Smith from The Cure.

In 1995, he abandoned Eurodance and adopted the name Mr. Jack (which would later morph into Junior Jack), dabbling in house music. He entered the UK Top 40 with the singles ""My Feeling"" <a href=""https://www.last.fm/music/Junior+Jack"">Read more on Last.fm</a>",384356,2372568,Armand van Helden
Piem,"After being exposed to House music of the 90's and early 2000's, Barcelona based Piem was destined to journey into the world of underground music. These early musical experiences helped to shape Piem into a firm favourite on the Barcelona club scene with a residency at W.

Meanwhile, locking himself away in his studio honing his sound, Piem's dedication continues to pay off with releases on well revered labels; Knee Deep in Sound, Crosstown Rebels, Moon Harbour, DFTD, ... <a href=""https://www.last.fm/music/Piem"">Read more on Last.fm</a>",18083,71065,Angelo Ferreri
LEFTWING : KODY,"Since forming in 2012, Leftwing & Kody have gone on to become two of the UK’s finest exports. Both Mixmag and DJ Mag named them as ones to watch a mere year after they paired up, with DJ Mag even nominating them for ‘Best Breakthrough DJ’ in their Best of British Awards. Since then the duo have gone on to present a monthly Rinse FM show, earn residencies at Fabric (London) and Sankeys (Ibiza), as well as releases on Hot Creations, VIVa, Truesoul, Mobilee and Knee Deep In Sound, as well as their own renowned imprint Lost Records. <a href=""https://www.last.fm/music/LEFTWING+:+KODY"">Read more on Last.fm</a>",65577,384322,Matt Guy
Nato Medrado," <a href=""https://www.last.fm/music/Nato+Medrado"">Read more on Last.fm</a>",7389,23711,Huminal
Sébastien Léger,"The son of two professional musicians, for 10 years Sébastien attended the academy of music learning technique and musical theory on piano and drums. Soon he began visiting record stores, where he was introduced to a new world of sounds and styles. What he liked most was what he heard from the likes of Daft Punk and other dance electronic music pioneers, and before long he stepped behind the turntables. In 1998 he started creating his own productions <a href=""https://www.last.fm/music/+noredirect/S%C3%A9bastien+L%C3%A9ger"">Read more on Last.fm</a>",71709,397830,Roy RosenfelD
Genix,"Real Name: Damion Houchen

Genix started producing records many years ago and gained his first record deal when he was just 18. 

His love of dance music and determination to get his unique sound rocking dance floors has led to him DJing across the UK and trotting the globe with his records, rubbing shoulders with many a-list DJs on the way. 

Gaining support with his productions from all the major DJ's Genix has gained a hat full of recording contracts, along with establishing his own record label.  <a href=""https://www.last.fm/music/Genix"">Read more on Last.fm</a>",62328,721771,Oliver Smith
Deviu,"DEVIU Rafael Lasso (better known as Deviu) is a Colombian Dj/Producer born in Pasto, 1998. He began producing electronic music in 2014. After studying audio and sound production in Medellin, Colombia, this young composer of different styles of the genre started his project as RL Deviu, 
producing Chill Out and Ambient music.
He began producing electronic music in 2014. After studying audio and sound production in Medellin, Colombia, this young composer of different styles of the genre started his project as RL Deviu <a href=""https://www.last.fm/music/Deviu"">Read more on Last.fm</a>",5406,24525,ppdee
Above & Beyond,"Above & Beyond is a British trance music group formed in 2000 in London, United Kingdom and consists of the members Jono Grant, Tony McGuinness, and Paavo Siljamäki.

The trio are popular in the electronic dance music scene for their forward-thinking uplifting trance productions and collaborations with renowned vocalists. They have their own record label, Anjunabeats, which releases trance & progressive music, and they also host their own weekly <a href=""https://www.last.fm/music/Above+&+Beyond"">Read more on Last.fm</a>",789688,23404211,Sunny Lax
nOIZU,"Los Angeles based Noizu is quickly climbing through the ranks of house music. Making his debut on the Chris Lake and Skrillex curated ‘HOWSLA’ in 2017 with ‘Lasers’ before catching the eyes and ears of French label boss Tchami. His follow up release saw the Jungle EP, an instant live anthem supported by Diplo, Oliver Heldens, A-Trak, Jauz, Malaa and more.

2018 started with singles ‘LFO’ and ‘Wavey’, gaining huge support from Sirius / Diplo Revolution. The latter in particular receiving over 200 plays. <a href=""https://www.last.fm/music/nOIZU"">Read more on Last.fm</a>",218089,1872910,
Ranger Trucco,"Ranger Trucco is one of house music’s fastest-rising talents. Combining effortless lyricism with infectious basslines, he wasted zero time cultivating a truly unique sound that resonates with electronic music fans globally. 

Both producer & vocalist - Ranger refused to let growing up 4 hours north of the nearest nightlife impede his plans of a future completely immersed in dance music culture. 

With performances at festivals and clubs nationwide on the horizon, it’s only up from here. <a href=""https://www.last.fm/music/Ranger+Trucco"">Read more on Last.fm</a>",15328,91996,Kyle Walker
Mirko Gorelli," <a href=""https://www.last.fm/music/Mirko+Gorelli"">Read more on Last.fm</a>",111,211,
&ME,"Real Name: André Boadu, DJ and producer from Berlin, Germany. 

When one could assume, &ME entered the House and Techno world somewhat out of the blue, it is due to his sublime modesty that’s already captured in his alias. Coming from Hamburg to Berlin in 2004 his talent was soon recognized by folks like DJ Hell or DJ T. who hired him as their co-producer. 
Besides, he was playing the clubs (national and international) all week every week and putting his effort in remixes for the likes of Roxy Music, Tiefschwarz or Anthony Rother. <a href=""https://www.last.fm/music/&ME"">Read more on Last.fm</a>",122561,951952,Rampa
Kaiserdisco,"German techno duo Kaiserdisco is making waves in the international electronic music scene with their unique blend of energetic beats and infectious melodies. Comprised of Frederic Berger and Patrick Buck, the duo has released a string of successful tracks on renowned labels such as Drumcode, Suara, and Tronic, among others.

With over a decade of experience, Kaiserdisco has become known for their dynamic DJ sets and productions that seamlessly fuse classic techno sounds with modern elements. <a href=""https://www.last.fm/music/Kaiserdisco"">Read more on Last.fm</a>",60243,318773,Gary Beck
DJ Clea," <a href=""https://www.last.fm/music/DJ+Clea"">Read more on Last.fm</a>",7603,22620,
TLIM SHUG," <a href=""https://www.last.fm/music/TLIM+SHUG"">Read more on Last.fm</a>",28677,167330,Tom Vernon
Kolter,"Kolter is the breakbeat alias of Johannes Kolter, DJ and producer from Cologne, Germany.
Formerly went by the name Djoko. <a href=""https://www.last.fm/music/Kolter"">Read more on Last.fm</a>",26491,188090,Darius
Head High,"Head High is an alias of German techno producer René Pawlowitz (best known as Shed). As Head High he has multiple 12-inches on his own Power House imprint and has remixed Martyn, 2562, Moderat, and Joy Orbison.

Head High is also the name of a hardcore band from southern California. <a href=""https://www.last.fm/music/Head+High"">Read more on Last.fm</a>",21409,135321,Shed
RINZEN,"California born and raised, Rinzen uncovered an interest in music and music-making as many young kids do, soundtracking college parties, dabbling in production in his down time and also balancing a career as a music journalist. With a wide breadth of understanding for the ongoing EDM boom happening Stateside, a timely trip to Europe exposed him to booming techno sounds and underground world of Richie Hawtin and Marco Carola. He returned with a refreshed palette <a href=""https://www.last.fm/music/RINZEN"">Read more on Last.fm</a>",19199,99980,Ocula
Kant,"Kant was an Latvian alternative metal band from Ogre, Latvia. The band, which was founded in 2000, consisted of Jānis Vītoliņš (vocals), Mareks Ezerkalns (guitars and keyboards), Jānis Rakvičs (guitars), Oskars Lelis (bass) and Mareks Kaminskis (drums).

The band's debut EP Impresija 7 was released in 2003, they broke up shortly after in 2004.

http://kant.times.lv <a href=""https://www.last.fm/music/Kant"">Read more on Last.fm</a>",133846,1610831,Costa Gold
F.E.M," <a href=""https://www.last.fm/music/F.E.M"">Read more on Last.fm</a>",667,2565,Telikan
Jeremy Olander,"There’s a new kid on the block and he’s the first-ever disciple of one of the most celebrated dance music producers of all time; Eric Prydz.

The hugely talented up-and-comer, Jeremy Olander, is set to cause quite a storm in the world of dance music throughout the course of this year. Championed by Prydz as ’the next big thing’, a man with 3 top 2 records under his belt and countless underground hits, Jeremy is already booked to tour Europe supporting the label boss at every major festival and event in 2011.  <a href=""https://www.last.fm/music/Jeremy+Olander"">Read more on Last.fm</a>",68506,460387,Just Her
Le Youth,"Le Youth is a leading figure in the dance music scene. He has amassed over 350,000,000 streams on the back of a plethora of releases and remixes on some of the most respected labels in the genre. From Lane 8's This Never Happened to Anjunabeats, Armada Electronic Elements and many more, Le Youth continues to push the boundaries with each release.

Inspired by the deep and melodic sounds of Lane 8, Ben Böhmer, Sasha, and Eric Prydz, Le Youth has dedicated himself to crafting music that works in every setting; from chilled nights in <a href=""https://www.last.fm/music/Le+Youth"">Read more on Last.fm</a>",305803,2976271,Lane 8
Mat.Joe,"There are few things sweeter than a bowl of ice cream, but Berlin house duo Mat.Joe have emulated a sound and style every bit as delectable. Matze and Johannes, two young men with a Hip Hop and House affection based in Berlin. Their productions come to life in a Neukölln backyard where studio equipment and DJ decks meet desiccated plants. 
 
A natural development when music has become the top priority from dusk till dawn. Back in 2006, Rap, Breakdance <a href=""https://www.last.fm/music/Mat.Joe"">Read more on Last.fm</a>",72203,356342,Hot Since 82
L.GU.,"Hailing from Italy, L.GU. is a Progressive House music producer and DJ who debut in Colorize (Enhanced) with his first 3-tracks EP. His connection with music started from child age. After experimenting with a wide range of instruments during his entire young-life, when discovers electronic music, he decide to totally pursue this music-making. With a taste for rock vibes and dominating yet dramatic basslines, L.GU.'s music spans deep and emotionally-charged sounds. <a href=""https://www.last.fm/music/L.GU."">Read more on Last.fm</a>",11173,64522,djimboh
Walker & Royce,"New York City’s Sam Walker & Gavin Royce have been producing their emotive, subdued and groove-heavy house since 2011

Walker & Royce started when Sam and Gavin, having known each other in and out of the dance scene for years, finally began working together in 2011. Crosstown Rebels boss Damian Lazarus noticed one of their very first releases. The result was the Crosstown Rebels EP ""You're Not Welcome"" and with that, Walker & Royce was launched into the dance music spotlight. <a href=""https://www.last.fm/music/Walker+&+Royce"">Read more on Last.fm</a>",68669,480070,Anti Up
Rodg,"In a world jam-packed with one-hit-wonders, extremely consistent Dance producers have always been sought after. And that makes Rodg one of the rare-breed. The humble Dutchman is one of the best kept Armada Music secrets, delivering top notch releases of unwavering quality on a regular basis. An impressive string of features on various Armada compilations proved to be the stepping stone for Rodg's versatile and exhaustive sound, long defining the renowned chill-out vibe and portraying baffling interpretations of the sound of summer. <a href=""https://www.last.fm/music/Rodg"">Read more on Last.fm</a>",69049,670144,Beatsole
Cid,"GRAMMY Award winning CID (“Best Remixed Recording”) has garnered attention from industry veterans like Kaskade and Tiesto, with booked gigs spanning the globe – from Las Vegas to Barcelona. The Queens (New York) based DJ/producer is ready to stake his claim on the world of dance music.

As a young Carlos Cid his passion for music was evident early on at age 11, venturing on a city bus to traverse the boroughs of New York, just to spend his days scouring through new music at his favorite record shop. <a href=""https://www.last.fm/music/Cid"">Read more on Last.fm</a>",165984,1092571,Thomas Gold
Zone+,"Bahraini born, Music producer & DJ. His sound consists of deep melodic grooves layered with hypnotic, emotional beats making the crowd move yet fly through his soundscapes
https://soundcloud.com/zone-plus
https://www.facebook.com/zoneplusmusic/ <a href=""https://www.last.fm/music/Zone%252B"">Read more on Last.fm</a>",5252,22871,Newman (I Love)
Swanky Tunes,"Of all the exciting new electro sounds coming out of the East these days - Swanky Tunes ranks among the most noteworthy.

The group formed in 1998, experimenting with different electronic stylings in pursuit of their own sound. At first, there were techno sounds mixed with vintage synthesizers. Then the group moved into a distinctly big-beat influenced sound. These days, hints of the French-house scene, early Depeche Mode, electro-80's, and the contemporary electro-house movement are all finding their way into the mix. <a href=""https://www.last.fm/music/Swanky+Tunes"">Read more on Last.fm</a>",185712,1227600,Rompasso
Pete K," <a href=""https://www.last.fm/music/Pete+K"">Read more on Last.fm</a>",14529,78860,Dezza
Soela,"Elina Shorokhova, better known as Soela is a DJ and music producer from Novocherkassk, Russia, currently living in Berlin, Germany. It is there where she continues to build her presence in the community through her live and DJ sets alongside documenting the local scene and artists through her lens as a photographer. She is an experienced pianist and vocalist who has made a hugely successful transition into electronic music.
Creating music that doesn’t fit into a mold but is crafted from her own style <a href=""https://www.last.fm/music/Soela"">Read more on Last.fm</a>",8371,62923,Alex Albrecht pres. Melquíades
Nora En Pure,"At the core of Indie Dance and Deep House music, Swiss based Nora En Pure is on a quest to fulfil her need to arouse feelings of bliss and inject unconventional and serene sensations to be carried out into the world. The vivid South African has already proven to be quite productive, what resulted in deep and funky works of audible engineering for the label Enormous Tunes and Tokenish since 2009. Besides her passion for Africa, only music has been <a href=""https://www.last.fm/music/Nora+En+Pure"">Read more on Last.fm</a>",340120,4565733,Passenger 10
Fisherman,"There are multiple artists that perform under the name Fisherman:

1. A South Korean Producer & member of WYBH
2. A Dutch trance DJ & Producer <a href=""https://www.last.fm/music/Fisherman"">Read more on Last.fm</a>",34555,302696,Chan
Dustycloud,"What kind of sounds come to mind when you think of house music? Is it light and soulful, or do you find yourself leaning toward darker, tougher tones? If the latter is more your vibe, there’s a good chance you’ve probably heard of Parisian producer Dustycloud, a mainstay act on Tchami’s Confession label and one of the more talented artists within the increasingly dominant modern house music movement. Alongside the likes of Malaa, Dombresky, Mercer <a href=""https://www.last.fm/music/Dustycloud"">Read more on Last.fm</a>",50113,427813,Sqwad
Event Horizon,"1. Melbourne-based metalcore band

Michael Godding - Vocals
Ryan Matheson - Guitar/Vocals
Tavis Pirie - Guitar
Brenton Leech - Drums
Jayden Hawse - Bass/Vocals

2. Electronica band Event Horizon is a collaboration between Tristan Cooke (UK psychedelic trance producer and DJ) and John-Mark James. 

3. Progressive death metal band from California. <a href=""https://www.last.fm/music/Event+Horizon"">Read more on Last.fm</a>",9155,39556,Digital Mystery Tour
Will Easton," <a href=""https://www.last.fm/music/Will+Easton"">Read more on Last.fm</a>",13039,55374,Milad E
Re.You,"It’s been a meteoric rise for Marius Maier, better known simply as Re.You, his success in the electronic music scene a distant cry from shattered hoop dreams. Now firmly Berlin-based, his prolific release schedule continues unabated, the live show with Rampa going from strength to strength as well as DJ sets at clubs across the world.

As a teenager in Ulm, a sleepy town in southern Germany, Marius first began to appreciate the dark arts of beats through a love of DJ Premier’s dark and jazzy cuts. <a href=""https://www.last.fm/music/Re.You"">Read more on Last.fm</a>",16595,64237,David Mayer
Kasablanca,"https://twitter.com/wearekasablanca
https://www.instagram.com/kasablanca/ <a href=""https://www.last.fm/music/Kasablanca"">Read more on Last.fm</a>",47229,373730,Simon Doty
104 BPM," <a href=""https://www.last.fm/music/104+BPM"">Read more on Last.fm</a>",383,1077,Your Dime
COEO,"German duo Coeo have been making waves recently on the underground House scene. With releases on esteemed labels such as Sccucci Manucci, Toy Tonics, Let's Play House, Seven Music or Dabit Records they are an act to watch over 2014! 

The DJ and production duo consists of Florian Vietz and Andreas Höpfl, 2 guys, who met during high school and shared a mutual love for hip hop and soul music. Some years later they fell in love with house music and spent more and more nights in their studio in Munich to write their own songs. <a href=""https://www.last.fm/music/COEO"">Read more on Last.fm</a>",98335,747629,Crazy P
Sound Quelle,"Sound Quelle is a project of Russian musician (Valery Lebedev) from the city of Togliatti. In his works, Sound Quelle focuses on a beautiful harmonious music in combination with moderately aggressive lines bass. All Time Sound Quelle has released his work at Armada, Black Hole,
Enhanced, Premier and many other labels, as well as to get support from the best DJs in the world such as: Above & Beyond, Markus Schulz, Ferry Corsten, Paul van Dyk, Paul Oakenfold, and many others. <a href=""https://www.last.fm/music/Sound+Quelle"">Read more on Last.fm</a>",83554,813365,Milkwish
Dombresky,"Although he hails from the south of France, Dombresky’s penchant for invigorating four- on-the-floor beats is pure house bliss. 

The DJ and producer burst onto the scene in 2016 when he arrived in Miami as Quentin Dombres, a then-unknown talent with an impressive roster of funky, feel-good tracks. Today he has become inextricably linked with industry heavyweights including Blondish, Armand van Helden, Diplo, Claptone, and MK, all of whom supported Dombresky’s early career endeavors as collaborators.  <a href=""https://www.last.fm/music/Dombresky"">Read more on Last.fm</a>",148332,1163013,Noizu
