Artista,Biografia,Listeners,Playcount,Artistas Similares
Anden,"There are three artits that go by the name of Anden. 1) is group consisting of brother Tom and Pete Cuppernull. 2) is Anders ""Anden"" Matthesen (born 1975) a Danish stand-up comedian, scriptwriter, actor and singer.

1) Anden - Tom and Pete Cuppernull
Brothers Tom and Pete Cuppernull have spent the last decade applying their lifelong musicianship to their music. Classically trained on the violin, cello, and trumpet, Anden's organic and warm productions have garnered cross-genre acclaim from Solomun <a href=""https://www.last.fm/music/Anden"">Read more on Last.fm</a>",43072,283687,De Nattergale
Shift K3Y,"Lewis Shay Jankel (born 27 May 1993), known by his stage name Shift K3Y, is an English producer and DJ from London. He is best known for his 2014 single ""Touch"", which peaked at number 3 on the UK Singles Chart.

Jankel released his debut EP Step in the City on 12 December 2011, through Marco Del Horno's record label Bullet Train. ""Manage Ya"", one of the EP tracks, was supported by BBC Radio 1 and 1Xtra DJs including MistaJam and Toddla T. On 23 July 2012, he released his second EP Left and Right with the label. <a href=""https://www.last.fm/music/Shift+K3Y"">Read more on Last.fm</a>",171802,1300814,M-22
Dillon Nathaniel,"Sonic manipulation is the cornerstone of Dillon Nathaniel’s unconventional approach to house music. In just a few short years the graduate of the revered Icon Collective and self professed gear junkie has proven himself to be a technical mastermind and modern house music connoisseur. The strength of his thick low-end grooves and quirky sound design have caught. the ears of A-Track, AC Slater, Destructo, Chris Lake, Malaa and Tchami. His sound has <a href=""https://www.last.fm/music/Dillon+Nathaniel"">Read more on Last.fm</a>",17556,84847,Keeld
Cassy,"Cassy (real name: Catherine Britton) left England for Austria in 1975 with her father.  Her first musical foray was as a vocalist for Elin (aka Autorepeat) on ""Music Takes Me Higher"".  It wasn't long before she turned her attention to mixing.  She was often found in the Vienna and Munich scenes, before moving to Berlin in 2003.  Shortly after she got involved with artists like Ricardo Villalobos and Steve Bug.  Her first solo release was ""My Auntie"" on Perlon records <a href=""https://www.last.fm/music/Cassy"">Read more on Last.fm</a>",20695,91540,Sammy Dee
Link,"Link is a name of at least seven acts:

1) A pseudonym of electronic music artist Mark Pritchard, who also records/has recorded as Reload, Harmonic 313, Troubleman, N.Y. Connection, William Parrott and Roberto Edwardo Turner (aka The Returner). His most notable tracks as Link include: Amenity and ""Arcadian"".

Mark's collaborative efforts include Global Communication, Jedi Knights, The Chameleon, Link & E621, Reload & E621 and Secret Ingredients, all with Tom Middleton <a href=""https://www.last.fm/music/Link"">Read more on Last.fm</a>",43665,265285,Balil
Sorley," <a href=""https://www.last.fm/music/Sorley"">Read more on Last.fm</a>",6539,25109,Will Taylor (UK)
Luttrell,"Luttrell is Eric Luttrell, an electronic music producer from San Francisco, California. He is signed to Anjunadeep. 




 <a href=""https://www.last.fm/music/Luttrell"">Read more on Last.fm</a>",84547,1240459,Yotto
Omnia,"
Omnia may refer to several artists, here listed in order of popularity on last.fm:

1.Self-described ""neoceltic pagan folk"" band based in The Netherlands and Belgium
2. Electronic dance music producer from Ukraine

1. Omnia is a self-described ""neoceltic pagan folk"" band based in The Netherlands and Belgium and whose members (and former members) are Irish, Dutch, Indonesian, English and Belgian. Their traditional music takes on the form of various cultural routes, from places around the world such as Ireland, England and Afghanistan. <a href=""https://www.last.fm/music/Omnia"">Read more on Last.fm</a>",260073,6610276,Faun
Helsloot,"Helsloot (born Thomas Helsloot) is a Dutch-based artist known for his melodic, futuristic, and heavily hip-hop-influenced take on techno and disco.

One of Helsloot's initial productions was a draft of ""Because You Move Me,"" which he sent to his producer friends, Tinlicker. The unexpected success provided Helsloot with the opportunity to step into the spotlight as an artist and refine his shows with his own productions. His work has been signed by labels such as Get Physical, Domino Records, This Never Happened, Ritter Butzke, and Anjunadeep. <a href=""https://www.last.fm/music/Helsloot"">Read more on Last.fm</a>",48717,294031,Nora En Pure
Riva Starr,"“…dance music’s future star. Colourful, exuberant and, crucially, dynamite on the dance floor.” 
(Q Magazine)

Riva Starr couldn’t be hotter right now. Stefano Miele from Napole - aka Riva Starr - has smashed out of the blogosphere with his unique patchwork of styles, swiftly establishing himself as one of the most unique and recognisable producer / DJ today. 

Riva – with his love for re-inventing any music that inspires him – has coined the term “Snatch!” to describe his very personal bootleg remix technique <a href=""https://www.last.fm/music/Riva+Starr"">Read more on Last.fm</a>",110323,570011,Wh0
Late Replies,"In a world where music reigns supreme, one duo has risen from the concrete jungle of North West London to take the industry by storm. Meet Late Replies - the unstoppable force of tech house beats that blend traditional and underground elements to create a music experience unlike any other.

With over 10 million streams on Spotify and countless fans across the globe, Late Replies have become a sensation that cannot be contained. Their music is an adrenaline-fueled ride of skippy rolling basslines and percussion that leaves crowds wanting more. <a href=""https://www.last.fm/music/Late+Replies"">Read more on Last.fm</a>",12367,45756,Max Chapman
Crusy,"Spanish DJ/Producer Crusy steps up on Exclusive Mix duties amid the hottest stretch in his career! After refocusing and retooling during the pandemic, he’s got an arsenal of new music that is doing serious damage. 

“Selecta” on Toolroom Trax has become his most DJ supported track ever including live plays from the likes of ACRAZE, Carl Cox, David Guetta, James Hype, John Summit, Malaa, and many more. Next week his new collaboration “El Beso” <a href=""https://www.last.fm/music/Crusy"">Read more on Last.fm</a>",11535,39822,ZOOTAH
Praana,"PRAANA (aka Tritonal) - Chad Cisneros, Dave Reed <a href=""https://www.last.fm/music/Praana"">Read more on Last.fm</a>",28702,305041,Matt Fax
Sebastian Sellares," <a href=""https://www.last.fm/music/Sebastian+Sellares"">Read more on Last.fm</a>",6372,40822,Ezequiel Arias
Kyau & Albert,"Kyau & Albert is the working name for two trance music producers and DJs from Germany named Ralph Kyau and Steven Moebius Albert. They were formerly known as Kyau vs. Albert but changed their working name to Kyau & Albert in 2006.

Ralph Kyau had his first experience with the production of electronic music in 1990 and gained a reputation for DJing as well as Live PA sets at several underground techno parties in Germany before releasing his first record ""Modulation Experiments"" at the end of 1993. <a href=""https://www.last.fm/music/+noredirect/Kyau+&+Albert"">Read more on Last.fm</a>",40330,531631,
Bot,"1) BOT (born as Andrea Fratangelo) is a british electronic music producer.
Bot is of the future. Half man, half-machine; fully Italian. Exiled in West London, locked in the studio since departing legendary duo Crookers, Bot (his creators named him Andrea Fratangelo) has disassembled any expectations and rebuilt his sound for 2018. Futuristic techno and unorthodox club rhythms are welded with hip hop influences, and a nod to the sounds and sprit of classic house. <a href=""https://www.last.fm/music/Bot"">Read more on Last.fm</a>",5996,22850,219 Boys
Tim Mason,"Tim Mason: 
Facebook, Twitter, Youtube, Soundcloud

Appropriately titled debut single ‘The Moment’ captured the imaginations of dance floors around the world. What just happened? Who’s this record by?

After weeks of support from the likes of Swedish House Mafia, Tiesto, David Guetta, Chemical Brothers and Calvin Harris, label boss Steve Angello revealed that this track was in fact the first instalment from Tim Mason, a new artist he’d signed to his record label, Size Records. <a href=""https://www.last.fm/music/Tim+Mason"">Read more on Last.fm</a>",53433,222838,Steve Angello
Morgin Madison," <a href=""https://www.last.fm/music/Morgin+Madison"">Read more on Last.fm</a>",26344,214922,No Mana
Cromby," <a href=""https://www.last.fm/music/Cromby"">Read more on Last.fm</a>",12170,43853,Brame & Hamo
Weiss,"There are at least three artists named Weiss:

1. WEISS, real name Richard Dinsdale, is a UK-based house music producer and DJ. In 2018, he had his first successful single ‘Feel My Needs’ that went on to become a Silver certified record in the UK. WEISS then signed a record deal with Island Records in the UK[1] and followed that up with a collaboration with Becky Hill ‘I Could Get Used to This’ which went on to become Gold certified. In 2020, he released ‘First Sight’ and ‘Where Do We Go’. <a href=""https://www.last.fm/music/Weiss"">Read more on Last.fm</a>",162332,1189187,Rachel Row
Isola,"There is more than one band named Isola.

1/  ＩＳＯＬＡ was a Japanese indie Visual Kei rock band, active around the year 2000. The line up was: Vocal: 姫 (Hime), Guitar: tsubaki, Guitar: 文 (Fumi), Bass: kei
They released a demotape, Over... . Their single, Egoiste Butterfly, was released in June 2001. It contains two tracks: 01 Egoiste Butterfly, 02 「Cruel」
These are the projects the members were involved with, after ISOLA's disbandment: 姫 (Hime) joined 洞 (Hora) to form Rudolf Steiner <a href=""https://www.last.fm/music/Isola"">Read more on Last.fm</a>",20893,125840,Headache
Saison,"London based house duo Saison have, over the last few years, carved out a niche of their own. Named the best deep house artist of 2018 and 2019 by Traxource, and one of the biggest selling deep house artist on Beatport, they have released on some of the most respected house labels in the world, including Defected, Toolroom, Large Music, Sonar Kollektiv, and Suara to name a few. 

They’ve also remixed many titans of the scene including such musically diverse artists as Jack Back, Chez Damier, Dave Lee and Kevin Yost. <a href=""https://www.last.fm/music/Saison"">Read more on Last.fm</a>",32204,160425,Marc Cotterell
SUBSHIFT," <a href=""https://www.last.fm/music/SUBSHIFT"">Read more on Last.fm</a>",12383,38019,Kapuzen
House Music,"House music was born in Chicago at places like the warehouse, underground, and powerplant. We, ""the children"" were enraptured by tunes created by the mixing genious of Frankie Knuckles.  Frankie Knuckles is the original and ONLY DJ that knows real house music, believe me I was there....... what a party.  AND IT WAS ALL DONE ON VINYL!

Mixing soungs from the Clark Sisters to Donna Summer to old R & B to gospel, Frankie Knuckles created House Music...Mixed versions of ""Let no man put Usunder"" and ""There but for the grace of God go I"" were my fav. <a href=""https://www.last.fm/music/House+Music"">Read more on Last.fm</a>",11934,54041,SRTW
Matt Sassari,"Being considered relatively known on the international scene, Marseille based DJ and producer Matt Sassari has suitably proven his strength in both the studio and behind the decks. 
 
With releases on notable labels such as CR2 / Truesoul / Panterre Musique / Terminal M / Intec / Relief Matts unique blend of Techno and Tech House made his first top 1 overall beatport chart with 'Put A Record On' in 2019. Followed by his newest 'Give it to me' record <a href=""https://www.last.fm/music/Matt+Sassari"">Read more on Last.fm</a>",341776,2422252,Kilian K
KC Lights,"Following an explosive few years, Scotland's multi-talented musician/DJ/producer KC Lights has firmly established himself as one of the most exciting UK talents on the scene. 

He grew up on a small island off the West Coast of Scotland, the Isle of Bute, and music grabbed his attention from an early age, with his love for composing and performing leading him to an honours degree and multiple awards at University. After a trip to Ibiza in his teens, KC Lights fell in love with electronic music. <a href=""https://www.last.fm/music/KC+Lights"">Read more on Last.fm</a>",98937,573610,Sonny Fodera
Bleu Clair,"Kurniawan Wicaksono (born April 21, 1995) or better known as Bleu Clair is an Indonesian musician and producer.

Delivering unparalleled tech and bass house delicacies from the studio, Indonesian born artist Bleu Clair is bringing to dance floors what one can only describe as flaunting house music for the future. Essentially, this young producer has curated a signature sound under his name that evokes a dynamic energy amongst the tech and bass house devotees and music industry pioneers alike. <a href=""https://www.last.fm/music/Bleu+Clair"">Read more on Last.fm</a>",56876,461032,Sqwad
MultiPlabell," <a href=""https://www.last.fm/music/MultiPlabell"">Read more on Last.fm</a>",13530,59105,RXDER
Markus Schulz,"Markus Schulz is a German progressive trance producer renowned for his unique style of dark, brooding yet melodic productions and DJ sets. He is head of his own label Coldharbour Recordings in co-operation with Armada and he is infamous for surprising his fans with his own edits and reconstructions of well-known songs. He is currently living in Miami, Florida

-------------------

Markus Schulz is a man on a mission. He dreams of meeting the world. <a href=""https://www.last.fm/music/Markus+Schulz"">Read more on Last.fm</a>",359119,4955029,Andrew Rayel
Motion Sky," <a href=""https://www.last.fm/music/Motion+Sky"">Read more on Last.fm</a>",348,851,Silk and Fuss
Biscits,"Southampton born and bred Biscits has enjoyed another high achieving year with releases on Thrive, Selected, his home label Solotoko & more. His productions have amassed over 2 million monthly listeners on Spotify alone and his track Your Body was one of the most played tech house tacks of 2021. He’s continued to gain the support of industry mentors and peers including Diplo, Sonny Fodera, Dom Dolla, Solardo and more.

Biscits has another busy year of releases lined up including a collaboration EP with Sonny Fodera & an album on Solotoko. <a href=""https://www.last.fm/music/Biscits"">Read more on Last.fm</a>",136019,1108074,Martin Ikin
Mark Knight,"Not to be confused with, the similarly named, video games and Chiptune composer - Mark 'TDK' Knight.

1) Mark Knight is head of Toolroom Records & a UK DJ / producer. He has stamped his impression on the scene of electronic dance music - through a string of releases & parties - highlighting his label. Often collaborating with fellow British DJ Funkagenda, Mark has been at the forefront of commercial house, techno & tech house. Some of his most successful releases are Man With The Red Face (with Funkagenda), Downpipe (with Underworld & D. <a href=""https://www.last.fm/music/Mark+Knight"">Read more on Last.fm</a>",257996,1773917,Hot Since 82
Crankstar," <a href=""https://www.last.fm/music/Crankstar"">Read more on Last.fm</a>",67,190,Coverrun
Nōpi," <a href=""https://www.last.fm/music/N%C5%8Dpi"">Read more on Last.fm</a>",11012,88250,Marsh
Crvvcks,"Crvvcks (pronounced Crookes), real name Joe Mafullul, is a electronic music DJ/producer based in Leeds from Nottingham who has found fans in BBC Radio 1, Rinse FM and Amazing Radio.  His music is a perfect mix of high energy upbeat dance tracks with a nod to classic House and Soul and downbeat chill out electronica. <a href=""https://www.last.fm/music/Crvvcks"">Read more on Last.fm</a>",31456,130039,NIGHTLAPSE
Ferry Corsten,"Ferry Corsten is a Dutch DJ, producer and recorder who first started out in 1991 producing underground hardcore gabber tracks. He soon expanded into clubhouse and trance music. But don't put Ferry into the trance corner, because his sound encompasses several genres of electronic music.

In 1999 Ferry Corsten was voted Best Producer of the Year at the Ericsson Muzik Award in London. In 2000, he was awarded Best Remix for Adagio for Strings (Ferry Corsten Remix) at the Dancestar 2000 awards. <a href=""https://www.last.fm/music/Ferry+Corsten"">Read more on Last.fm</a>",671756,9500729,Cosmic Gate
Local Singles," <a href=""https://www.last.fm/music/Local+Singles"">Read more on Last.fm</a>",5458,22303,ROXE
Loge21," <a href=""https://www.last.fm/music/Loge21"">Read more on Last.fm</a>",15348,82567,Bellecour
Delroy Edwards,"Born in March 28, 1990, Delroy Edwards is a Los Angeles-based house producer. His first release was 4 Club Use Only 12"" on Brooklyn-based label, L.I.E.S., in 2012.

Soundcloud
Discogs <a href=""https://www.last.fm/music/Delroy+Edwards"">Read more on Last.fm</a>",144247,1920604,Rezzett
KiNK,"KiNK is an Bulgarian acid techno and acid house producer, also known with his attempts in experimental styles. His his first release - ""Same ol' thing"" was released by the UK label Odori and hit the house charts of several online vinyl shops.

With the support of names such as Josh Wink, Richie Hawtin, Laurent Garnier, Surgeon and Modeselektor, KiNK is rapidly gaining momentum in the electronic music industry and is proving himself as a unique and consistent producer. <a href=""https://www.last.fm/music/KiNK"">Read more on Last.fm</a>",113462,796797,Maceo Plex
Breach,"More than one artist exists by the name of Breach:

1. A punk band from Sweden.

2. An electronic music producer from Bristol, UK.


1. Noisy and furious somewhere between the tribal angst-filled sound of NEUROSIS and TORTOISE. Luleå, Sweden 1993: The local punkband Superdong split up. A lot of people couldn't care less. Now we know better. One half of Superdong quickly forms Fireside, and the other half becomes Breach.

Luleå turns out to be a <a href=""https://www.last.fm/music/Breach"">Read more on Last.fm</a>",138826,1569935,Knut
Pirate Copy," <a href=""https://www.last.fm/music/Pirate+Copy"">Read more on Last.fm</a>",5902,19848,Tini Gessler
ZHU,"Steven Zhu, known mononymously as Zhu, is an American electronic music producer and singer who has been active since the beginning of 2014, signed to Mind of a Genius Records. Until mid-2014, Zhu remained anonymous, asking to be judged by his music alone. <a href=""https://www.last.fm/music/ZHU"">Read more on Last.fm</a>",798024,14544003,Bob Moses
Tom Staar,"Deep within the solar system, past the rocky contours of the moon & beyond the fizzing gases of Jupiter, a lone space traveller named Tom Staar searches for his long lost colony of intergalactic compadres.

Not knowing if he is the last of his kind means his search is never ending & his methods of communication unorthodox. It's a long time since he's seen another member of his species, but one thing he still remembers is how much they liked to dance! So in a bid to make contact, Tom likes to send interstellar messages... in the form of songs! <a href=""https://www.last.fm/music/Tom+Staar"">Read more on Last.fm</a>",60227,289334,Shapov
Enzo Siragusa," <a href=""https://www.last.fm/music/Enzo+Siragusa"">Read more on Last.fm</a>",7028,25956,Archie Hamilton
Sonny Fodera,"Hailing from Adelaide, Australia Sonny Fodera's story is starting to gain momentum; having started producing music at a young age he has established himself as one of Australia’s premier deep jackin house dj's and producers, artist/remixer. As a dj, his signature sound showcases smooth technical wizardry combined with a music selection geared to satisfy even the most discerning house music listeners.

Having played along side the likes of Chuck Love <a href=""https://www.last.fm/music/Sonny+Fodera"">Read more on Last.fm</a>",283056,2698529,MK
Paul Thomas,"Paul Thomas: a biography

The last five years has seen the UK house music scene storm the world like never before, with a vanguard of talented new DJs and producers who have welded the traditional sound with techno, progressive, trance and electro influences in explosive fashion. Their time is now, and Paul Thomas is amongst this new wave’s brightest stars.

Paul’s big break was landing a residency at Birmingham’s Godkitchen and their globally-syndicated <a href=""https://www.last.fm/music/Paul+Thomas"">Read more on Last.fm</a>",34637,172601,Matan Caspi
Deep House2021," <a href=""https://www.last.fm/music/Deep+House2021"">Read more on Last.fm</a>",658,8441,Fitness Dj
Chris Lorenzo,"Producer, remixer, DJ and Rinse FM host, Birmingham UK's Chris Lorenzo is widely acknowledged for pioneering his hometown's emergent and increasingly popular Jackin' house come Bassline hybrid sound, which he terms simply ""House & Bass"". 

Having built up specialist support with releases on a plethora of tastemaker labels, including Claude Von Stroke's Dirtybird label and Shadow Child & Kry Wolf's lauded Food Music label, Lorenzo has also been called upon to remix My Nu Leng for Black Butter and Disclosure for PMR.  <a href=""https://www.last.fm/music/Chris+Lorenzo"">Read more on Last.fm</a>",252963,2030838,Dom Dolla
Rampa,"From 2009 on, Rampa made a name of himself through Keinemusik, his own little d.i.y.-cosmos, being not only label, but also crew of likeminded DJs, producers and friends. The teamwork within this realm has seen a serious number of productions and collaborations, particularly with fellow producer &ME, not to forget the rest of the bunch, Adam Port, Reznik and Monja.

Besides, he’s got an array of other collaborations and releases under his belt, put out on imprints like Circoloco <a href=""https://www.last.fm/music/Rampa"">Read more on Last.fm</a>",112751,793056,&ME
Yotto,"Otto Yliperttula (born October 8, 1986), known professionally by his stage name, Yotto, is a Finnish DJ, songwriter, and record producer. Currently residing in Helsinki, Finland, the 30-year-old is signed to English deep house label, Anjunadeep.

Yotto came to fruition with a string of remixes and originals that caught the ear of Anjunadeep label boss, James Grant. Deemed “a man of many sounds” by Billboard and “an experimental house talent” by Dancing Astronaut <a href=""https://www.last.fm/music/Yotto"">Read more on Last.fm</a>",175132,2294264,Luttrell
Reelow,"Hungarian-born, Barcelona-based DJ/Producer, Reelow, has a knack for churning prowling bass lines and indelible riffs into heavy hitting dance floor records. Reelow’s sound is not limited to one genre but incorporates influences from jazz, soul, breakbeat, hip-hop and techno.

As an evolving power house producer, Reelow owns a host of impressive releases on labels such as Time Has Changed, Moan, Serkal, Inmotion Music, CellaaMusic, Kosmophono, Yoruba Grooves and Hopeless just to name a few. <a href=""https://www.last.fm/music/Reelow"">Read more on Last.fm</a>",4646,18318,Dimmish
ENNE (BR)," <a href=""https://www.last.fm/music/ENNE+(BR)"">Read more on Last.fm</a>",5659,22131,bewav
DEL-30," <a href=""https://www.last.fm/music/DEL-30"">Read more on Last.fm</a>",10747,44848,Nightfunk
Christian Nielsen,"Danish DJ and producer Christian Nielsen, is a rare commodity in the world of House and Techno. While other producers might pander to the masses, Nielsen, never opts for a novelty approach, instead carving his own successful niche in a constant jostle for dance floor play. 

Christian Nielsen is an artist who has seemed to come out of nowhere. Working in an office by day and developing his musical craft by night.

That said, his sound is a classic one <a href=""https://www.last.fm/music/Christian+Nielsen"">Read more on Last.fm</a>",12353,40811,Local Dialect
Kyle Walker,"Los Angeles (California) native, Kyle Walker is an act that has made monumental waves in the music scene almost instantly upon beginning his career. Influenced early on from the heavier side of electronic music, his largest inspirations, in the beginning, came from Skrillex, Doctor P, Flux Pavilion and Kill Paris. Five years and countless hours of studio time later, Kyle stumbled across Disclosure’s Grammy award-winning album “Settle” and instantly became connected to house music. <a href=""https://www.last.fm/music/Kyle+Walker"">Read more on Last.fm</a>",20036,87888,Ranger Trucco
J. Worra,"Classic house meets new school tech with Native Chicagoan now Los Angeles-based DJ and producer Jamie Sitter, a.k.a. “ J. Worra ”. Best known for her creativity as a producer and skills behind the decks, she brings an inimitable swagger and technical prowess to dance music’s underground scene, lending these unique skills to every venture of her life spanning music, fashion, and art.

Hailed as DJ Mag’s 2019 Breakthrough Music Producer of the Year <a href=""https://www.last.fm/music/J.+Worra"">Read more on Last.fm</a>",136390,939222,Sidepiece
Sqwad,"japcore band with ex-Ghoul members <a href=""https://www.last.fm/music/Sqwad"">Read more on Last.fm</a>",24463,99499,Bleu Clair
Matt Fax,"Matt Fax is a 22 years old producer and DJ from France. Started to produce under this alias in 2012, Matt saw him grow up really fast in the EDM scene, with releases on top labels from the like of Anjunabeats, Armada Music or even Enhanced Music. He is also the youngest guest mixer on Above & Beyond's Group Therapy show, as well as the youngest producer to release on Anjunabeats and the most played artist on Group Therapy radio show.

Matt received support from all the best DJs in the EDM scene <a href=""https://www.last.fm/music/Matt+Fax"">Read more on Last.fm</a>",95093,857091,Estiva
