Artista,Biografia,Listeners,Playcount,Artistas Similares
The Gentle Men,"The Gentle Men is a New Zealand-American musical duo consisting of Cr1TiKaL (Charles White Jr.) and Solstate (Troy McKubre). The duo was formed in 2019. In April of the same year, their first single, ""2019 Guy,"" was released. The song eventually became popular amongst the YouTube community and was featured in PewDiePie's YouTube Rewind 2019. In the year 2020, the duo released five more singles in February, May, June, October, and December, titled ""Obsession,"" ""Real to Me,"" ""Skynut,"" ""2004 Breakup,"" and ""I Am Truth. <a href=""https://www.last.fm/music/The+Gentle+Men"">Read more on Last.fm</a>",75751,1474067,Bad Omens
Polar States," <a href=""https://www.last.fm/music/Polar+States"">Read more on Last.fm</a>",3388,19042,Al Moses
Disclosure,"Disclosure are Guy Lawrence and Howard Lawrence, brothers from Surrey, United Kingdom. Crafting their own lo-fi dream-dub sound, Disclosure effortlessly combine 2-step garage rhythms and dubstep basslines with their own rich musical heritage of soul, jazz and 90s hip hop. After their debut single on Moshi-Moshi Records in September 2010, the duo released a 4 track EP on Transparent Records the year after. 2012 saw the release of ""Tenderly/Flow"" and ""The Face"" EP on Greco-Roman. <a href=""https://www.last.fm/music/Disclosure"">Read more on Last.fm</a>",1957558,60525426,AlunaGeorge
Lukas Graham,"Lukas Graham is a Danish pop band consisting of vocalist Lukas Graham Forchhammer (born September 18, 1988), drummer Mark ""Lovestick"" Falgren (born November 28, 1988), bassist Magnus Larsson (born September 9, 1990) and keyboardist Kasper Daugaard (born June 14, 1989). 

Launching their debut album in 2012 on Copenhagen Records, Lukas Graham quickly became a popular live act in Denmark. That success translated to the rest of Europe and caught the attention of Warner Bros. <a href=""https://www.last.fm/music/Lukas+Graham"">Read more on Last.fm</a>",953857,12923475,Calum Scott
Haedes," <a href=""https://www.last.fm/music/Haedes"">Read more on Last.fm</a>",526,4237,Paramod
Dua Lipa,"Dua Lipa (born August 22, 1995) is an English-Albanian singer-songwriter. She was born in London of refugee parents from The Republic of Kosovo, growing up between both countries until fully moving back to London at age 15.

Dua Lipa began to write her name in the music industry. Lipa gained attention from the specialized media as an artist after the release of her debut album in 2017,  ""Dua Lipa"" (self-titled). It won the third position on the UK Albums Chart and featured eight singles. <a href=""https://www.last.fm/music/Dua+Lipa"">Read more on Last.fm</a>",2613323,245592309,Katy Perry
5god.2020," <a href=""https://www.last.fm/music/5god.2020"">Read more on Last.fm</a>",155,1043,Bunky S.A.
Makenzie," <a href=""https://www.last.fm/music/Makenzie"">Read more on Last.fm</a>",3712,14160,The Amours
War,"There are at least nine artists with this name: 

1. WAR were a popular funk group of the '70s. They mixed soul, jazz, blues, reggae, Latin and rock influences in their music.  They had a very recognizable sound, due to their mix of harmonica, horns, guitar, bass, percussion, and vocals. WAR was initially formed in 1969 from a band called Nightshift to jam while Eric Burdon free-associated lyrics.  They released two albums under Burdon's name, the first of which contained the hit Spill the Wine. <a href=""https://www.last.fm/music/War"">Read more on Last.fm</a>",830556,6235082,Eric Burdon & WAR
why don't we,"Why Don't We (commonly abbreviated as WDW) is an American pop quintet that was assembled on September 27, 2016, consisting of Jonah Marais, Corbyn Besson, Daniel Seavey, Jack Avery, and Zachary ""Zach"" Herron, each of whom had previously recorded as solo artists. Their fandom name is called ""Limelights"", due to a lyric from their debut single.

The band was originally formed on September 27, 2016, and announced it the next day via their YouTube account. Since then, the band has released three EPs and two albums. <a href=""https://www.last.fm/music/why+don%27t+we"">Read more on Last.fm</a>",603947,16938331,
D.O.D,"There are 3 types of D.O.D.  the first is Do or Die a four piece band from San Francisco, comprising of two women and two men who are no longer playing together. 

The Second is Duo of Darkness a three piece band from Groningen; The Netherlands comprising of three friends rhymin' their way to the top. (www.last.fm/music/duo+of+darkness)

The third is is a British house music DJ & Producer, D.O.D <a href=""https://www.last.fm/music/D.O.D"">Read more on Last.fm</a>",264613,3329928,Noizu
Olivia Rodrigo,"Olivia Isabel Rodrigo (born February 20, 2003) is an American singer, songwriter, and actress. She gained recognition with her lead roles on the Disney television programs Bizaardvark and High School Musical: The Musical: The Series. After signing with Geffen and Interscope Records, Rodrigo released her debut single ""drivers license"" in 2021, which broke various records and became one of the best-selling songs of the year, propelling her to mainstream fame. She followed it up with the singles ""deja vu"" and ""good 4 u"". <a href=""https://www.last.fm/music/Olivia+Rodrigo"">Read more on Last.fm</a>",2332536,376568402,Taylor Swift
Top 40 Hip-Hop Hits," <a href=""https://www.last.fm/music/Top+40+Hip-Hop+Hits"">Read more on Last.fm</a>",2011,7067,Juicy J feat. Lil Wayne and 2 Chainz
The Living Strange,"From Brooklyn, New York, USA <a href=""https://www.last.fm/music/The+Living+Strange"">Read more on Last.fm</a>",981,5744,soklo
Gorillaz,"Gorillaz are a British virtual band created in 1998 by musician Damon Albarn and artist Jamie Hewlett. The band currently consists of four animated members: Murdoc Niccals (bass guitar) who formed the band, 2-D (lead vocals, keyboards), Noodle (guitar, vocals) and Russel Hobbs (drums and percussion). Their fictional universe is explored through animated music videos, interviews and animated shorts. In reality, Albarn is the only permanent musical contributor and often collaborates with other musicians. <a href=""https://www.last.fm/music/Gorillaz"">Read more on Last.fm</a>",5606929,362059542,Damon Albarn
female rapper," <a href=""https://www.last.fm/music/female+rapper"">Read more on Last.fm</a>",13,44,
EDX,"EDX is a worldwide acclaimed remixer, well known for his brilliant work for the likes of Dubfire, Deadmau5, Armand van Helden, Steve Angello, Sucker DJs, Michael Procter, Kool & The Gang, Lauryn Hill, Kaskade and Armin van Buuren, to name but a few.
Enormous Diverse Xample (of a genius) might not be an accurate, but for sure a possible interpretation of the three letters EDX. Productive and successful for more then a decade, Italian native artist <a href=""https://www.last.fm/music/EDX"">Read more on Last.fm</a>",253455,2257185,Michael Calfan
David Smets," <a href=""https://www.last.fm/music/David+Smets"">Read more on Last.fm</a>",34,63,
Echosmith,"Echosmith is an alternative pop/rock band formed in Los Angeles, California in 2009. The band consists of the Sierota Siblings, Graham, Sydney and Noah. Graham plays drums, Sydney sings lead vocals and occasionally plays guitar or keys, Noah plays bass and sings backup vocals. Brother Jamie used to be the guitarist and sang backup vocals but left the band in 2016.

Echosmith signed to Warner Bros Records in May 2012. In 2012 they released a single <a href=""https://www.last.fm/music/Echosmith"">Read more on Last.fm</a>",882330,9940368,MisterWives
Bebe Rexha,"Bleta Rexha, known professionally as Bebe Rexha, is an American singer and songwriter. After signing with Warner Records in 2013, Rexha received songwriting credits on Eminem's single ""The Monster"" and has also contributed songwriting to songs recorded by Shinee, Selena Gomez and Nick Jonas. Rexha released her debut EP in 2015, I Don't Wanna Grow Up, which saw the moderate commercial success of the singles ""I Can't Stop Drinking About You"" and ""I'm Gonna Show You Crazy"". <a href=""https://www.last.fm/music/Bebe+Rexha"">Read more on Last.fm</a>",1194554,32070788,Rita Ora
Soulballet," <a href=""https://www.last.fm/music/+noredirect/Soulballet"">Read more on Last.fm</a>",13,61,
bazzi,"Andrew Bazzi (born August 28, 1997), known by his surname, Bazzi (/ˈbɑːzi/ BAH-zee), is an American singer-songwriter and record producer. His song ""Mine"", released in October 2017, gained popularity in early 2018 when it became a meme through Musical.ly edits, and the use of a Snapchat lens filter featuring the song. It peaked at number 11 on the US Billboard Hot 100 and appeared on several international charts. He released his debut studio album COSMIC in 2018, which peaked at number 14 on the Billboard 200 chart. <a href=""https://www.last.fm/music/bazzi"">Read more on Last.fm</a>",1149435,28699089,
JZAC," <a href=""https://www.last.fm/music/JZAC"">Read more on Last.fm</a>",33851,291524,Ollie Joseph
OGRE Sound,"Robin Ogden (OGRE / OGRE Sound) is a composer for games and visual media, self confessed tape loop splicer, spring reverb tickler, and harbinger of imagined soundtracks for films that don't exist.

His work is grounded in a lifelong love affair with sound, whether produced from wonky analog synthesizers of yester-decades, contact microphones or strange and wonderful handmade instruments.

His music can be found in the award winning indie games Actual Sunlight <a href=""https://www.last.fm/music/OGRE+Sound"">Read more on Last.fm</a>",140554,1643462,Absolute Valentine
Henry Arts," <a href=""https://www.last.fm/music/Henry+Arts"">Read more on Last.fm</a>",8,57,
Curb,"There are at least two bands under the Curb moniker:
1. Curb are a skate thrash band from Milwaukee, Wisconsin, influenced by booze, chicks, weed, partying, skateboarding, doomriders, and Municipal Waste! 
2. CURB (stylised in all caps) are a Singaporean trio: an alt-rock, 'midwest' emo band, formed of members Sam, Farizi, and Lucas. <a href=""https://www.last.fm/music/Curb"">Read more on Last.fm</a>",4160,34819,Woes
Topic,"There are several artists with the name Topic.

1. Tobias Topic (born March 23, 1992) is a Croatian-German DJ, producer and musician. In 2008, he started using Logic Studio, a digital audio workstation, to produce music with the guidance of a teacher. He started his musical career on social media with the assistance of YouTube musicians who contacted him.

Topic's first release, a house song called ""Light It Up"", was released at the end of 2014 and reached more than one million views on his YouTube channel. <a href=""https://www.last.fm/music/Topic"">Read more on Last.fm</a>",463256,5161114,Felix Jaehn
Hex,"Hex may refer to one of several bands:
1) Hex is a Slovak pop rock group, founded in 1989 in Bratislava with Peter Ďuďo Dudák (vocals, guitar, keyboards), Thomas Yxo Dohňanský (bass guitar, vocals), Jozef Joshka Juřička (keyboards), Peter Slameň (percussion ) Martin Fefe Žúži (guitar).http://www.hex.sk/
The group became known to the media after it took producer Martin Sarvas and the issue maxisinglu song ""Good Butterfly"" in music publishing Monitor EMI <a href=""https://www.last.fm/music/Hex"">Read more on Last.fm</a>",42888,473775,Para
20/20,"20/20 was formed in Tulsa, OK by high school friends Steve Allen (guitar, vocals) and Ron Flynt (bass, vocals). They're known today as a popular power pop band, preceding as well as being a part of the late 70s power pop boom among bands such as Cheap Trick, The Knack, and The Records. Tracks ""Cheri"" and ""Yellow Pills"" have been included in several multi-artist power pop collections, with the 'Yellow Pills' title becoming a sort of underground shorthand for the scene. <a href=""https://www.last.fm/music/20%2F20"">Read more on Last.fm</a>",19952,177672,Alex Chilton
the44thfloor," <a href=""https://www.last.fm/music/the44thfloor"">Read more on Last.fm</a>",2142,6784,LUXAGE
Workout Music," <a href=""https://www.last.fm/music/Workout+Music"">Read more on Last.fm</a>",10225,97568,Workout Music Tv
Lady Gaga,"Stefani Joanne Angelina Germanotta, known professionally as Lady Gaga, (born March 28, 1986 in New York, NY) is an American singer, songwriter and actress. She is known for her image reinventions and musical versatility. Gaga began performing as a teenager, singing at open mic nights and acting in school plays. She studied at Collaborative Arts Project 21, through the New York University Tisch School of the Arts, before dropping out to pursue a career in music. <a href=""https://www.last.fm/music/Lady+Gaga"">Read more on Last.fm</a>",6248960,609021834,Madonna
Bülow,"After releasing her powerful debut Damaged Vol. 1, German born pop iconoclast bülow has instantly resonated with critics and new fans alike. The tracks “Like This Guy”, “Lines”, and “Not A Love Song” clocked millions of streams in a matter of weeks, instantly reaching the Spotify Global Viral chart and earning praise as “beautifully crafted” (NME), “pop genius” (Noisey), and a ""star in the making” (Pigeon &amp; Planes). A child of the globe <a href=""https://www.last.fm/music/B%C3%BClow"">Read more on Last.fm</a>",385605,5414952,Kailee Morgue
Tove Lo,"Ebba Tove Elsa Nilsson, known professionally as Tove Lo, is a Swedish singer and songwriter. She is known for her raw, grunge-influenced take on pop music. Her honest, complex and autobiographical lyrical content has led to her being dubbed ""the saddest girl in Sweden"".

Raised in the Djursholm district of Danderyd, Lo is an alumna of the music school Rytmus Musikergymnasiet. She formed the rock band Tremblebee in 2006. After it disbanded, Lo pursued a career in songwriting and earned a publishing deal with Warner/Chappell Music in 2011. <a href=""https://www.last.fm/music/Tove+Lo"">Read more on Last.fm</a>",1939825,98867189,Ellie Goulding
Emma Andrews," <a href=""https://www.last.fm/music/Emma+Andrews"">Read more on Last.fm</a>",19,26,
Maroon 5,"Maroon 5 is an American pop rock band that originated in Los Angeles, California, United States. The group was formed in 1994 as Kara's Flowers while its members were still in high school and originally consisted of Adam Levine (lead vocals, guitar), Jesse Carmichael (guitar, backing vocals) Mickey Madden (bass guitar) and Ryan Dusick (drums). Kara's Flowers signed to Reprise Records and released an album, ""The Fourth World"", in 1997. After a tepid response to the album <a href=""https://www.last.fm/music/Maroon+5"">Read more on Last.fm</a>",5483190,202328304,OneRepublic
Tesher," <a href=""https://www.last.fm/music/Tesher"">Read more on Last.fm</a>",137697,1179758,Badshah
capespring.," <a href=""https://www.last.fm/music/capespring."">Read more on Last.fm</a>",1291,8990,Maya Amolo
benee,"Stella Bennett (born January 30, 2000), known professionally as Benee (/ˈbɛniː/, stylized BENEE, formerly spelled Bene) is a New Zealand musician from Grey Lynn in Auckland.

Stella Rose Bennett was born and raised in the suburb of Grey Lynn in Auckland. She grew up in a ""really musical"" family with parents who would expose her to the catalogs of Radiohead, Björk, and Groove Armada. From the age of eight, BENEE began taking guitar lessons in primary school before starting saxophone lessons in high school. <a href=""https://www.last.fm/music/benee"">Read more on Last.fm</a>",814575,17060108,
Luis Fonsi,"Luis Alfonso Rodríguez López-Cepero, more commonly known as Luis Fonsi, (born April 15, 1978 in San Juan, Puerto Rico) is a Latin Grammy winning Puerto Rican singer, composer and soap opera actor.

Fonsi and his family moved to Orlando, Florida, during Fonsi's early childhood. Fonsi's childhood was relatively average for kids his age, beginning to dream about becoming a member of Menudo, arguably Latin America's most famous boy band in history, around the time he was ten years old. <a href=""https://www.last.fm/music/Luis+Fonsi"">Read more on Last.fm</a>",1079790,12113893,David Bisbal
Hailee Steinfeld,"Hailee Steinfeld (December 11, 1996) is an American actress, model, and singer. She is known for her portrayal of Mattie Ross in the 2010 film True Grit. She also played Petra Arkanian in the 2013 sci-fi film Ender's Game. She portrayed Juliet Capulet in the 2013 film adaptation of William Shakespeare's romantic tragedy Romeo & Juliet, Zooey Renner in the 2014 crime film 3 Days to Kill, and Violet in Begin Again. In 2015, she played Emily Junk in the sequel Pitch Perfect 2. <a href=""https://www.last.fm/music/Hailee+Steinfeld"">Read more on Last.fm</a>",1042174,21444208,Daya
Pomplamoose,"Pioneering the style of ""videosongs"" on popular video-sharing sites such as YouTube, Pomplamoose is a San Francisco-based indie music and indie jazz duo consisting of multi-instrumentalists Jack Conte and Nataly Dawn. Starting their online presence in the summer of 2008 and naming themselves after a derivation on the French word pamplemousse, meaning ""grapefruit"", Pomplamoose has garnered a strong and significant fan following ever since. They are known for their rich and brilliant layering of a multitude of instruments <a href=""https://www.last.fm/music/Pomplamoose"">Read more on Last.fm</a>",452085,7366931,Nataly Dawn
Train to Mars," <a href=""https://www.last.fm/music/Train+to+Mars"">Read more on Last.fm</a>",5108,23207,TommyMuzzic
Wayword," <a href=""https://www.last.fm/music/Wayword"">Read more on Last.fm</a>",3401,20654,Witchin Alleys
The Revivalists,"The Revivalists is an American rock band formed in New Orleans, Louisiana, in 2007. The 7-piece band consists of Ed Williams (pedal steel guitar, guitar), David Shaw (lead vocals), Zack Feinberg (guitar), Rob Ingraham (saxophone), George Gekas (bass guitar), Andrew Campanelli (drums, percussion), and Michael Girardot (keyboards, trumpet). The group's sound has been described as ""a Crescent City-rhythm spin on jam-band jubilee.""

Since forming in 2007 <a href=""https://www.last.fm/music/The+Revivalists"">Read more on Last.fm</a>",281531,3565112,Nathaniel Rateliff & the Night Sweats
Hedley,"Hedley was a Canadian pop rock group that originated in Abbotsford, British Columbia, originally formed in 2003. They were named after the unincorporated community of Hedley, British Columbia, a name chosen after members heard that it was for sale for $346,000. After lead singer Jacob Hoggard placed third on the second season of Canadian Idol in 2004, the group signed with Universal Music Canada and released their self-titled debut studio album the following year. <a href=""https://www.last.fm/music/Hedley"">Read more on Last.fm</a>",188434,4302105,Down with Webster
Jonas Brothers,"The Jonas Brothers are an American pop rock band. Formed in 2005, they gained popularity from the Disney Channel children's television network and consists of three brothers from Wyckoff, New Jersey; Kevin Jonas, Joe Jonas and Nick Jonas. 

In the summer of 2008, they starred in the Disney Channel Original Movie Camp Rock and its sequel, Camp Rock 2: The Final Jam. They also starred as Kevin, Joe, and Nick Lucas, the band JONAS, in their own Disney Channel series JONAS, which was later re-branded for its second season as Jonas L. <a href=""https://www.last.fm/music/Jonas+Brothers"">Read more on Last.fm</a>",1711409,48687335,Joe Jonas
Synth Poppers," <a href=""https://www.last.fm/music/Synth+Poppers"">Read more on Last.fm</a>",2421,7486,Chilo Escobedo
Ava Watson," <a href=""https://www.last.fm/music/Ava+Watson"">Read more on Last.fm</a>",263,1114,Clarice Morris
Chach,"Chach is a Texas-based rapper and producer. He is a member of both Bloodhounds and Goonncity. <a href=""https://www.last.fm/music/Chach"">Read more on Last.fm</a>",13435,179511,Bloodhounds
Selena Gomez,"Selena Marie Gomez (born July 22, 1992 in Grand Prairie, TX) is an American singer, actress and film producer. Gomez began her acting career on the children's television series Barney & Friends (2002–2004). As a teenager, she rose to prominence for starring as Alex Russo on the Disney Channel television series Wizards of Waverly Place (2007–2012). Alongside her television career, Gomez appeared in the films Another Cinderella Story (2008), Princess Protection Program (2009) <a href=""https://www.last.fm/music/Selena+Gomez"">Read more on Last.fm</a>",2416309,150245842,Selena Gomez & the Scene
dereck d.a.c.," <a href=""https://www.last.fm/music/dereck+d.a.c."">Read more on Last.fm</a>",1753,7905,Para Fiction
Niall Horan,"Niall James Horan (born 13 September 1993) is an Irish singer-songwriter. He rose to prominence as a member of the boy band  One Direction, formed in 2010 on the singing competition The X Factor. The group released five albums and went on to become one of the best-selling boy bands of all time.

Following the band's hiatus in 2016, Horan signed a recording deal as a solo artist with Capitol Records and has since released three albums: Flicker (2017) <a href=""https://www.last.fm/music/Niall+Horan"">Read more on Last.fm</a>",1089993,54302937,Louis Tomlinson
Remixed Factory," <a href=""https://www.last.fm/music/Remixed+Factory"">Read more on Last.fm</a>",3556,20717,remix kings
Pierre Colin,"Pierre Colin (fl. 1539–1569) was a French composer active at the Cathedral of Autin between about 1539 and 1569, as maistre des enfants and organist. Chiefly a composer of sacred music, seven chansons are ascribed to him in the publications of Attaingnant and Du Chemin. Text of “Comment, mon cueur”apparently from G. d’Aurigny’s Tuteur d’amour of 1546. William C. Lengefeld, “Colin, Pierre,” New Grove 2, VI, 106-07. <a href=""https://www.last.fm/music/Pierre+Colin"">Read more on Last.fm</a>",24,84,Eustorg de Beaulieu
Libby Quinn," <a href=""https://www.last.fm/music/Libby+Quinn"">Read more on Last.fm</a>",380,2534,Touchdown Jesus
Login,"Lazar boamelle <a href=""https://www.last.fm/music/Login"">Read more on Last.fm</a>",19451,342667,50landing
Billie Eilish,"Billie Eilish Pirate Baird O'Connell (born December 18, 2001), known professionally as Billie Eilish, is a Grammy and Academy Award-winning American singer and songwriter signed to Darkroom/Interscope Records. Born and raised in Los Angeles, Eilish grew up in a household of actors and musicians and was homeschooled along with her brother Finneas O'Connell. At the age of eight, she joined the Los Angeles Children's Choir, developing the soulful vocals that would later appear on her early singles. <a href=""https://www.last.fm/music/Billie+Eilish"">Read more on Last.fm</a>",3232185,525464972,FINNEAS
Mabel,"Mabel Alabama Pearl McVey (born on 19 February 1996 in Málaga, Spain) is a British singer and songwriter. She is the daughter of Swedish hit singer Neneh Cherry and British hit producer Cameron McVey. At age fifteen, Mabel enrolled at the Stockholm music school Rytmus Musikergymnasiet, a music high school, where she took a three-year course in songwriting, production and music theory.

Mabel released her debut single ""Know Me Better"" in July 2015, which caught the attention of BBC Radio 1 DJ Annie Mac, who made the song her Tune of the Week. <a href=""https://www.last.fm/music/Mabel"">Read more on Last.fm</a>",616300,11636962,Rita Ora
Computer Graphics," <a href=""https://www.last.fm/music/Computer+Graphics"">Read more on Last.fm</a>",7055,65069,Rad Machine
Made famous by Ke$ha," <a href=""https://www.last.fm/music/Made+famous+by+Ke$ha"">Read more on Last.fm</a>",151,388,Made famous by Britney Spears
Jeremy Zucker,"Jeremy Zucker (born March 3, 1996) is an American singer-songwriter best known for his song ""Comethru"", which has accumulated over 200 million streams on Spotify, as well as ""All the Kids Are Depressed"". In 2015, his song titled ""'Bout It"", featuring Daniel James & Benjamin O, was met with some commercial success and garnered millions of streams across SoundCloud and Spotify. Zucker has cited Jon Bellion, Blackbear, Eden, Bon Iver and Wet as some of his musical influences. <a href=""https://www.last.fm/music/Jeremy+Zucker"">Read more on Last.fm</a>",878154,34894845,Chelsea Cutler
Lucas & Steve,"Lucas & Steve is a dutch future/deep house music band comprising of members Lucas de Wert and Steven Jansen, originally from Maastricht (in the Limburg province).

In December 2014, the band was signed to Spinnin' Deep (a Spinnin' Records sub-label). <a href=""https://www.last.fm/music/Lucas+&+Steve"">Read more on Last.fm</a>",234706,2914600,Mike Williams
Avenue Beat,"Avenue Beat is an American girl group from Quincy, Illinois, composed of members Sami Bearden, Savana Santos and Sam Backoff. Backoff and Santos were friends growing up and met Bearden at a theater camp in high school; the trio then began traveling back and forth to Nashville where they are now based. The group is signed to The Valory Music Co. and Tape Room Records.

Avenue Beat debuted with their self-titled EP released on July 26, 2019, with ""Ruin That for Me"" acting as the lead single. <a href=""https://www.last.fm/music/Avenue+Beat"">Read more on Last.fm</a>",104975,858084,Leyla Blue
Universal Production Music," <a href=""https://www.last.fm/music/Universal+Production+Music"">Read more on Last.fm</a>",25504,146594,Damon Baxter
Lil Skeet," <a href=""https://www.last.fm/music/Lil+Skeet"">Read more on Last.fm</a>",4141,17732,Yung Chainz
Lilly Oxford," <a href=""https://www.last.fm/music/Lilly+Oxford"">Read more on Last.fm</a>",3386,11902,James Major
The Jagged Edges," <a href=""https://www.last.fm/music/The+Jagged+Edges"">Read more on Last.fm</a>",3432,11632,Chelsea Lee Greenwood
Urban Sound Collective," <a href=""https://www.last.fm/music/Urban+Sound+Collective"">Read more on Last.fm</a>",5726,22347,Jim Eyes
