Artista,Biografia,Listeners,Playcount,Artistas Similares
late night drive home,"late night drive home is an indie rock band from El Paso, Texas consisting of lead singer Andre Portillo, guitarist Juan ""Ockz"" Vargas, bassist Freddy Baca, and drummer Brian Dolan. Their music captures everything from the complexity of teenage angst to the beauty of youthful joy. With heartfelt lyrics and a gritty sound, late night drive home brings a refreshing presence into the indie rock scene.

The band began in 2019 as a fun project between Ockz and Andre. <a href=""https://www.last.fm/music/late+night+drive+home"">Read more on Last.fm</a>",359823,6524039,Mind’s Eye
Grouplove,"Grouplove is an indie pop band which formed in 2009 in Los Angeles, California, United States. The band consists of Christian Zucconi (vocals, guitar), Hannah Hooper (vocals, keyboards), Andrew Wessen (vocals, guitar), Sean Gadd (bass, vocals), and Ryan Rabin (drums). The band released their debut album, Never Trust a Happy Song, in September 2011, which was followed by Spreading Rumours, released September 2013. Both albums were produced by the band's drummer Ryan Rabin, who is the son of former Yes guitarist and film composer Trevor Rabin. <a href=""https://www.last.fm/music/Grouplove"">Read more on Last.fm</a>",1864050,32075231,Cold War Kids
Material Girls," <a href=""https://www.last.fm/music/Material+Girls"">Read more on Last.fm</a>",1059,6619,Warm Bodies
Le Monkey," <a href=""https://www.last.fm/music/Le+Monkey"">Read more on Last.fm</a>",223,1344,Linctus
Jenna Raine,"Jenna Raine Simmons (born February 17, 2004), also known as Jenna Raine, is a singer-songwriter from Westlake, Texas, and former member of the girl group L2M. Her early musical influences included Ed Sheeran, Taylor Swift, and gospel music. Her first single, ""Us,"" was released in 2018, and her first EP, ""Nen,"" followed in January 2019. Later that year, she toured with Max & Harvey and In Real Life before releasing her second EP, ""Be Like You,"" in November. <a href=""https://www.last.fm/music/Jenna+Raine"">Read more on Last.fm</a>",175400,1573205,Dylan Conrique
Sofía Reyes,"Sofia Reyes is a Mexican singer and songwriter who has been nominated twice to the Latin American Music Awards, MTV Europe Music Awards, Premios Juventud and Latin GRAMMYs among many others. She has amassed nearly one billion views on YouTube and two billion global streams with hits including 1,2,3 with Jason Derulo & De La Ghetto with more than 461 million streams and R.I.P featuring Rita Ora and Anitta, with more than 190 million streams. Chosen <a href=""https://www.last.fm/music/Sof%C3%ADa+Reyes"">Read more on Last.fm</a>",210292,2029978,Sofia Reyes
Elektronomia,"Elektronomia (born 1997 in Finland) is a Finnish music producer that creates dance and electronic music. He is one of the youngest music producers who was very successful as a nineteen-year-old. He is best known as the author of the hit ""Sky High"". He is also known for his collaboration with the British label NoCopyrightSounds. Apart from songs, he also creates remixes.

History
He started his musical career in 2015 as Elektronomia. But actually he really started his music career since 2012 as Electric Signals"" <a href=""https://www.last.fm/music/Elektronomia"">Read more on Last.fm</a>",79418,1023531,Jim Yosef
Gwen Stefani,"Gwen Renée Stefani  (born October 3, 1969 in Fullerton, CA) is an American singer-songwriter and fashion designer. Since 1986 she has fronted the rock band No Doubt, whose 1995 release Tragic Kingdom spawned the singles Just a Girl, Spiderwebs, and Don't Speak and propelled them into stardom with sales of 16 million copies worldwide. 

In 2004, Stefani released her first solo album Love. Angel. Music. Baby. The album featured several collaborations with producers and other artists <a href=""https://www.last.fm/music/Gwen+Stefani"">Read more on Last.fm</a>",3551417,60833172,No Doubt
Sam Smith,"Samuel Frederick Smith (born 19 May 1992) is an English singer and songwriter. They rose to prominence in October 2012 after being featured on Disclosure's breakthrough single ""Latch"", which peaked at number eleven on the UK Singles Chart. Smith was subsequently featured on Naughty Boy's ""La La La"", which became a number one single in May 2013. In December 2013, they were nominated for the 2014 Brit Critics' Choice Award and the BBC's Sound of 2014 poll, winning both. <a href=""https://www.last.fm/music/Sam+Smith"">Read more on Last.fm</a>",2565781,92550560,Jessie J
Lizzo,"Melissa Jefferson (born April 27, 1988 in Detroit, Michigan, U.S.), known professionally as Lizzo, is an American rapper and singer. She is a founding member of indie hip hop groups The Chalice, Grrrl Prty, The Clerb, Ellypseas, and Absynthe. Her debut album, Lizzobangers, was released in 2013. In 2015, she released her sophomore album, Big Grrrl Small World.

Born in Detroit in the late 80’s, Lizzo spent much of her formative years in the church <a href=""https://www.last.fm/music/Lizzo"">Read more on Last.fm</a>",1462845,47161820,Chlöe
James HYPE,"James Hype (born 1989) is an English DJ, producer and remix artist from Liverpool.[1][2]

He is best known for his single ""More Than Friends"", released by Warner Music on 7 July 2017. The single reached number 8 in the UK Top 40[3] and number 1 in the UK dance singles chart.[4]

Before chart success, James made his name producing remixes for international artists including OT Genesis and Clean Bandit[5] He is also a DJ ambassador for the equipment manufacturer Pioneer DJ featuring in their online videos.[6] <a href=""https://www.last.fm/music/James+HYPE"">Read more on Last.fm</a>",449098,4870131,
Sassydee," <a href=""https://www.last.fm/music/Sassydee"">Read more on Last.fm</a>",13330,58697,alegra
Freakin Genius," <a href=""https://www.last.fm/music/Freakin+Genius"">Read more on Last.fm</a>",119,343,Heartbits
Fern Murphy," <a href=""https://www.last.fm/music/Fern+Murphy"">Read more on Last.fm</a>",1524,9639,Sungaze
Cpektir," <a href=""https://www.last.fm/music/Cpektir"">Read more on Last.fm</a>",677,6050,Sunwarper
Ed Askew,"Ed Askew (born Edward C. Askew in Stamford, Connecticut, in 1940) is an American singer-songwriter and painter who first recorded in 1968. He collaborated with Sharon Van Etten on his 2013 album For the World.

Askew is known for his album in the original ESP Disk’s vague rock/folk/freak series, issued eponymously and since reissued as Ask The Unicorn. 

Years later, thanks to detective work by Clint Simonson of the De Stijl Records imprint, it <a href=""https://www.last.fm/music/Ed+Askew"">Read more on Last.fm</a>",35577,240377,Judee Sill
Harms,"Metalcore/sludge band from Lappeenranta, Finland.

https://lnk.to/HARMS <a href=""https://www.last.fm/music/Harms"">Read more on Last.fm</a>",2599,20562,Henrik!
POP ETC,"POP ETC is an American indie band from Berkeley, California. The band was formerly known as The Morning Benders. 

As The Morning Benders the band released a number of EPs and two full-length albums: Talking Through Tin Cans (2008) and Big Echo (2010). 

On March 25, 2012, the band posted on Facebook and Twitter that the band's name would be changed to POP ETC. Their first album under the new name is the self-titled POP ETC (2012).

The band consists of Julian Harmon, Tim Or, Jonathan Chu and Christopher Chu.

Website: www.popetcetera.com <a href=""https://www.last.fm/music/POP+ETC"">Read more on Last.fm</a>",128021,885979,Imperial Mammoth
David Guetta,"Pierre David Guetta is a French DJ and music producer. He has sold over 10 million albums and 65 million singles globally, with more than 14 billion streams. In 2011, 2020, and 2021, Guetta was voted the number one DJ in the DJ Mag Top 100 DJs poll. In 2013, Billboard crowned ""When Love Takes Over"" as the number-one dance-pop collaboration of all time, with singer Kelly Rowland.

He released his first album, Just a Little More Love, in 2002. Later, he released Guetta Blaster (2004) and Pop Life (2007). <a href=""https://www.last.fm/music/David+Guetta"">Read more on Last.fm</a>",4511001,151470921,Calvin Harris
208," <a href=""https://www.last.fm/music/+noredirect/208"">Read more on Last.fm</a>",711,8085,
Creek," <a href=""https://www.last.fm/music/Creek"">Read more on Last.fm</a>",2768,24207,Ghostt
The Chainsmokers,"A production duo featuring Andrew Taggart and Alex Pall, the Chainsmokers mix indie, dance, and pop into a chart-topping sound that spawned hits like ""Roses,"" ""Closer,"" and ""Don't Let Me Down."" Pall and Taggart first made a name for themselves by creating remixes of their favorite indie bands that garnered tens of millions of streams. The duo released its official debut single, ""#Selfie,"" which celebrated and skewered 2010s narcissism, in January 2014. <a href=""https://www.last.fm/music/The+Chainsmokers"">Read more on Last.fm</a>",2153381,65267736,Jonas Blue
Moxie Raia," <a href=""https://www.last.fm/music/Moxie+Raia"">Read more on Last.fm</a>",38350,191590,Rozzi Crane
Juice WRLD,"Jarad Anthony Higgins (born December 2nd, 1998; died December 8th, 2019), known professionally as Juice WRLD, was an American hip-hop musician from Chicago, Illinois. He was primarily known for his breakout hits, ""All Girls Are The Same"" and ""Lucid Dreams"", the latter of which peaked at number #2 on the Billboard Hot 100. The album enjoyed positive critical reception, and contained three other singles: ""Armed and Dangerous"", ""Lean Wit Me"" and ""Wasted (feat. <a href=""https://www.last.fm/music/Juice+WRLD"">Read more on Last.fm</a>",1870107,363843635,Trippie Redd
East End Brothers," <a href=""https://www.last.fm/music/East+End+Brothers"">Read more on Last.fm</a>",1711,4736,Countdown Singers
Gp.,"gP. (known as Ghost Parade) is a ‘futuresexrock’ band from San Francisco, CA who’s been paving the way with their new blend of sounds. Having received album press nationally (Alt Press, Idobi Radio, MySpace, etc) and internationally (RockSound), gP. has been on the road supporting their new release “Destroy, So as to Build”, making new fans and friends everywhere they’ve performed.  <a href=""https://www.last.fm/music/Gp."">Read more on Last.fm</a>",15076,102339,New Language
Tough Rhymes," <a href=""https://www.last.fm/music/Tough+Rhymes"">Read more on Last.fm</a>",6918,28307,Platinum Deluxe
Today's Hits!," <a href=""https://www.last.fm/music/Today%27s+Hits%21"">Read more on Last.fm</a>",724,3342,Molly Shiveley
,,,,
Anne-Marie,"Essex, England-born Anne-Marie Nicholson was no stranger to performing by the time her debut EP dropped in 2015, having shared the stage as a 12-year-old with none other than Jessie J in a West End production of Whistle Down the Wind. She also auditioned for Les Misérables without telling her parents, and was offered a part. It was a risk that paid off, as it served to open her parents' eyes to her singing ability. Aside from West End commitments <a href=""https://www.last.fm/music/Anne-Marie"">Read more on Last.fm</a>",976051,17094751,Rita Ora
Ellie Goulding,"Ellie Goulding (born Elena Jane Goulding, 30 December 1986 in Hereford, England) is an English singer-songwriter. Having caught the public's attention in 2010 with her singles ""Starry Eyed"" and ""Guns and Horses,"" British vocalist Ellie Goulding quickly rose to the top of the charts with her infectious electronic pop sound. Although she started out writing songs in a folk-inflected style, she eventually grew into a more electronic-influenced artist, touching upon dance music and ambient synth pop. <a href=""https://www.last.fm/music/Ellie+Goulding"">Read more on Last.fm</a>",3212556,121939927,Rita Ora
Room 201," <a href=""https://www.last.fm/music/Room+201"">Read more on Last.fm</a>",139,1498,Lil Wiz
Aaaron," <a href=""https://www.last.fm/music/Aaaron"">Read more on Last.fm</a>",11430,40650,INVŌKER
Twenty One Pilots,"Twenty One Pilots (stylized in all lowercase or as twenty øne piløts) is an American musical duo from Columbus, Ohio. Initially a band, the group was formed in 2009 by lead vocalist Tyler Joseph along with Nick Thomas and Chris Salih, who both left in 2011. Since their departure, the line-up has consisted of Joseph and drummer Josh Dun. The duo is best known for their singles ""Stressed Out"", ""Ride"", and ""Heathens"". The group received a Grammy Award for Best Pop Duo/Group Performance at the 59th Annual Grammy Awards for ""Stressed Out"". <a href=""https://www.last.fm/music/Twenty+One+Pilots"">Read more on Last.fm</a>",2485790,242169763,
3OH!3,"3OH!3 is an American electronica group from Boulder, Colorado, named after the 303 area code which covers Boulder, Aurora and the Denver metropolitan area. Formed in 2004, Sean Foreman and Nathaniel Motte were inspired by the hip-hop electronic scene and Foreman invited Motte to mix some beats and hang out with him. They released their self-titled debut album in 2007, but it was not a commercial success. Their second album, Want, was released in July <a href=""https://www.last.fm/music/3OH%213"">Read more on Last.fm</a>",1553940,38897410,Breathe Carolina
Piano Dreamers," <a href=""https://www.last.fm/music/Piano+Dreamers"">Read more on Last.fm</a>",66771,842287,Piano Tribute Players
Chelsea Locklear," <a href=""https://www.last.fm/music/Chelsea+Locklear"">Read more on Last.fm</a>",113,402,Wyld
Faith Healer,"Long before Jessica Jalbert began recording under the solo moniker Faith Healer, she fostered a tight collaborative friendship with fellow Edmonton-bred polymath Renny Wilson. They’ve made boppy garage rock in Tee-Tahs, kicked up a racket in Punk Explosion, and even played in a scattering of cover bands. In 2011, Wilson was a key contributor to Jalbert’s solo album Brother Loyola.

So when Jalbert set about creating her new solo album under the name Faith Healer <a href=""https://www.last.fm/music/Faith+Healer"">Read more on Last.fm</a>",14692,130495,EZTV
Moderns,"There are several bands called The Moderns or Moderns.

1. Moderns (also known as 'The Moderns') was a mod revival band from Sweden that existed from 1979 to 1981. It was made up of three high school friends that had previously served in the british invasion cover band Buddyboys. They self-released an EP, ""Got to Have Pop"", in January 1979. They also released their final 45 ""Ready for the 80s"" in 1980 and-- after a successful tour in the UK-- their only LP ""Tro, Hopp & Fruktan"" in 1981. <a href=""https://www.last.fm/music/Moderns"">Read more on Last.fm</a>",33038,309433,Dream Shore
MKX," <a href=""https://www.last.fm/music/MKX"">Read more on Last.fm</a>",5286,32121,John Duff
Marshmello,"(1) Chris Comstock, better known by his stage name Marshmello, was born on May 19, 1992. He is an American electronic dance music producer and DJ. He first gained international recognition by remixing songs by Jack Ü and Zedd, and later collaborated with artists including Omar LinX, Ookay, Jauz and Slushii. In January 2017, his song ""Alone"" appeared on the U.S. Billboard Hot 100 chart.
In 2018, he released ""Friends"", a collaboration with British singer Anne-Marie which peaked in the top 20 in the US. <a href=""https://www.last.fm/music/Marshmello"">Read more on Last.fm</a>",2013583,51355330,Martin Garrix
Nasty Power," <a href=""https://www.last.fm/music/Nasty+Power"">Read more on Last.fm</a>",172,397,Heartbits
Post Malone,"Austin Richard Post (born July 4, 1995), known professionally as Post Malone, is an American rapper, singer, songwriter, and record producer. Known for his variegated vocals, Malone has gained acclaim for blending genres and subgenres of hip-hop, pop, R&B, and trap. His stage name was derived from inputting his birth name into a rap name generator

Malone began his music career in 2011 and gained recognition with his 2015 debut single ""White Iverson"", which peaked at number 14 on the US Billboard Hot 100. <a href=""https://www.last.fm/music/Post+Malone"">Read more on Last.fm</a>",2807676,249334828,Tyla Yaweh
Lorde,"Ella Marija Lani Yelich-O'Connor, known professionally as Lorde (born 7 November 1996 in Takapuna, Auckland, New Zealand), is a New Zealand singer-songwriter. Taking inspiration from aristocracy for her stage name, she is known for her unconventional musical styles and introspective songwriting.

Lorde expressed interest in performing at local venues in her early teens. She signed with Universal Music Group (UMG) in 2009 and collaborated with producer Joel Little in 2011 to start recording music. <a href=""https://www.last.fm/music/Lorde"">Read more on Last.fm</a>",2978704,284003997,Caroline Polachek
Dembek," <a href=""https://www.last.fm/music/Dembek"">Read more on Last.fm</a>",1168,3863,Colin!
Nicole Knight," <a href=""https://www.last.fm/music/Nicole+Knight"">Read more on Last.fm</a>",16,52,
Will Berger," <a href=""https://www.last.fm/music/Will+Berger"">Read more on Last.fm</a>",2138,13832,Andrés Galván
Vibe2Vibe," <a href=""https://www.last.fm/music/Vibe2Vibe"">Read more on Last.fm</a>",8665,40543,James Major
Easy Smith," <a href=""https://www.last.fm/music/Easy+Smith"">Read more on Last.fm</a>",1145,4423,Lil Glory
Unholy,"There is more than one artist with this name.

1) Unholy was a Finnish doom metal band that was considerably influential to funeral doom and death-doom styles. They formed in the late '80s as Holy Hell, and changed their name to Unholy in 1990. They released two demos in 1990 (""Procession of Black Doom"" and ""Demo 11.90""), an EP ""Trip to Depressive Autumn"" in 1991 and four full-lengths: ""From the Shadows"" in 1993 on Lethal Records, ""The Second Ring of Power"" (1994), ""Rapture"" (1998) and ""Gracefallen"" (1999) on Avantgarde Music. <a href=""https://www.last.fm/music/Unholy"">Read more on Last.fm</a>",39199,562306,diSEMBOWELMENT
Thomas Rivera," <a href=""https://www.last.fm/music/Thomas+Rivera"">Read more on Last.fm</a>",1935,6227,Bryan Moore
Ashley Craig," <a href=""https://www.last.fm/music/Ashley+Craig"">Read more on Last.fm</a>",1615,5433,Heartbits
Jess Glynne,"Jessica Hannah ""Jess"" Glynne (born 20 October 1989) is an English singer-songwriter. She is signed to Atlantic Records UK.[4] 

She is best known for featuring on Clean Bandit's 2014 single ""Rather Be""; the song reached number one on the UK Singles Chart and Irish Singles Chart. She also featured on Route 94's single ""My Love"", which was released weeks later and also reached number one on the UK Singles Chart and Scottish Chart. 

Her debut single, ""Right Here"", has charted at number 6 in the UK. <a href=""https://www.last.fm/music/Jess+Glynne"">Read more on Last.fm</a>",613971,9140552,Ella Henderson
Top 40," <a href=""https://www.last.fm/music/+noredirect/Top+40"">Read more on Last.fm</a>",2216,7376,
Demi Lovato,"Demetria Devonne Lovato, professionally known as Demi Lovato, is an American singer, songwriter and actress. After appearing on the children's television series Barney & Friends (2002–2004), Lovato rose to prominence for playing Mitchie Torres in the musical television film Camp Rock (2008) and its sequel Camp Rock 2: The Final Jam (2010); the former film's soundtrack contained ""This Is Me"", Lovato's debut single and duet with Joe Jonas, which peaked at number nine on the Billboard Hot 100. <a href=""https://www.last.fm/music/Demi+Lovato"">Read more on Last.fm</a>",2672894,146650872,Demi Lovato & Joe Jonas
Alessia Cara,"Alessia Cara (born Alessia Caracciolo on July 11, 1996) is a Canadian singer-songwriter from Brampton, Ontario, Canada.  She signed to EP Entertainment/Def Jam Recordings and is best known for ""Here"", her debut single from her EP Four Pink Walls and her album Know-It-All, both debuting in 2015. Prior to her work with EP Entertainment/Def Jam, Cara was known for her acoustic song covers on YouTube.

Born in Mississauga, Ontario, she wrote poetry and did theater at a young age. <a href=""https://www.last.fm/music/Alessia+Cara"">Read more on Last.fm</a>",1345844,27927877,Julia Michaels
Sabrina Carpenter,"Sabrina Annlynn Carpenter (born May 11, 1999) is an American singer and actress. She first gained recognition starring on the Disney Channel series Girl Meets World (2014–2017), and signed with the Disney-owned Hollywood Records. She released her debut single, “Can't Blame a Girl for Trying” in 2014, followed by four studio albums: Eyes Wide Open (2015), Evolution (2016), Singular: Act I (2018), and Singular: Act II (2019); three of her singles—“Alien”,  “Almost Love”, and “Sue Me”—topped the US Dance Club Songs chart. <a href=""https://www.last.fm/music/Sabrina+Carpenter"">Read more on Last.fm</a>",2142406,251041047,Taylor Swift
Ultimate Dance Hits," <a href=""https://www.last.fm/music/Ultimate+Dance+Hits"">Read more on Last.fm</a>",9163,44703,DJ ReMix Factory
DJ ReMix Factory," <a href=""https://www.last.fm/music/DJ+ReMix+Factory"">Read more on Last.fm</a>",18182,96394,Lingyi
Todays Top Hits," <a href=""https://www.last.fm/music/Todays+Top+Hits"">Read more on Last.fm</a>",1146,4665,2022 Hit Songs Music Mix
VAllEY,"There are four bands with the name Valley.
Also see, The Valley.

 Valley is a 4 piece alternative pop band from Toronto. The 4 friends met by coincidence when they were accidentally double booked at a studio in late 2013. Valley takes pride in writing and self producing their music in their home studio where they have successfully released 1 EP and a debut LP, MAYBE. The band recently supported Lennon Stella on her sold out North American theatre tour and will be supporting The Band Camino through North America this upcoming fall 2019. <a href=""https://www.last.fm/music/VAllEY"">Read more on Last.fm</a>",288523,7880900,
Kbubs," <a href=""https://www.last.fm/music/Kbubs"">Read more on Last.fm</a>",6441,44395,Over Easy
2022 Hit Songs Music Mix," <a href=""https://www.last.fm/music/2022+Hit+Songs+Music+Mix"">Read more on Last.fm</a>",559,1549,Gaming Music 2022
Popular Songs," <a href=""https://www.last.fm/music/Popular+Songs"">Read more on Last.fm</a>",686,4018,Travis Scott - Topic
Bruno Mars,"Peter Gene Hernandez (born October 8, 1985 in Honolulu, HI, USA), known professionally as Bruno Mars, is a Filipino-American singer, songwriter, record producer, musician, and dancer. He is known for his stage performances, retro showmanship, and for performing in a wide range of musical styles, including pop, R&B, funk, soul, reggae, disco, and rock. Mars is accompanied by his band, the Hooligans, who play a variety of instruments, such as electric guitar, bass, piano, keyboards, drums, and horns, and also serve as backup singers and dancers. <a href=""https://www.last.fm/music/Bruno+Mars"">Read more on Last.fm</a>",4129905,195503290,"Bruno Mars, Anderson .Paak, Silk Sonic"
All-4-One,"All-4-One is a male soul and rnb group, best known for their hit single ""I Swear"" from their self-titled 1994 debut album. ""I Swear,"" a remake of the country hit from John Michael Montgomery, won the 1995 Grammy Award for Best Pop Performance By A Duo Or Group With Vocal and enjoyed an eleven-week run at #1 on the Billboard Hot 100 as well as a seven-week run at #2 in the U.K. Praised for their four-part harmonies and smooth sound, they had their most success in the 90s. <a href=""https://www.last.fm/music/All-4-One"">Read more on Last.fm</a>",322405,1690302,K-Ci & JoJo
Logan Paul,"Logan Alexander Paul (born April 1, 1995) is an American YouTube personality and actor. He first gained fame through videos shared on the internet video service Vine.

Paul later branched out into acting in television series and films. His television work includes a guest appearance on Law & Order: Special Victims Unit and a role in the comedy film Weird Loners. His film work includes the dystopian science fiction YouTube Red film The Thinning and the adult comedy Airplane Mode. <a href=""https://www.last.fm/music/Logan+Paul"">Read more on Last.fm</a>",69883,393468,RiceGum
Chris Shotz," <a href=""https://www.last.fm/music/Chris+Shotz"">Read more on Last.fm</a>",2,99,
LXST," <a href=""https://www.last.fm/music/LXST"">Read more on Last.fm</a>",72294,1147673,Nick Bonin
Labrinth,"Timothy Lee McKenzie, better known by his stage name Labrinth, is a British singer, songwriter, rapper and record producer. After initially pursuing a career in music production, Simon Cowell signed him to his record label Syco Music as a recording artist, after which Labrinth became the first singer who Cowell signed without having competed on a talent show in six years. He has been referred to as ""one of the most important British musicians of his generation"". <a href=""https://www.last.fm/music/Labrinth"">Read more on Last.fm</a>",2108259,58405911,Labrinth & Zendaya
Gayle,"Taylor Gayle Rutherford, known professionally as GAYLE, is an American singer-songwriter. After signing with Atlantic Records, she released the single ""abcdefu"" in 2021, which has charted worldwide and reached number one in the United Kingdom and Ireland.

GAYLE was born on June 10, 2004, in Dallas, Texas, United States. She is of Scottish descent. She started singing when she was seven and eventually moved to Nashville, Tennessee to pursue a musical career. <a href=""https://www.last.fm/music/Gayle"">Read more on Last.fm</a>",667777,7512996,
Barnacle Boi,"Ian Oliver (professionally known as barnacle boi) is an American record producer, DJ, vocalist, and visual artist based on the East Coast. barnacle boi developed his production style during his few years living in Denver, Colorado and has stuck with it ever since. He is known for his original work, as well as his production for artists such as Bones (TeamSESH), Holly Stell, Madi Larson, and more. He has received support and recognition from Alice Glass (former frontwoman of  the well-known electronic duo ""Crystal Castles"") <a href=""https://www.last.fm/music/Barnacle+Boi"">Read more on Last.fm</a>",73371,951731,CHVRN
