Artista,Biografia,Listeners,Playcount,Artistas Similares
We Are The Union,"We Are the Union is an American ska punk band formed in Detroit, Michigan in August 2005. According to the band they formed the band because they were unhappy with the current state of ska music. <a href=""https://www.last.fm/music/We+Are+The+Union"">Read more on Last.fm</a>",52386,1283538,no data
23 Skunks," <a href=""https://www.last.fm/music/23+Skunks"">Read more on Last.fm</a>",484,6210,Matamoska!
The Adjusters,"There are several artists with the name The Adjusters:

1) The Adjusters, a socially conscious Chicago ska/soul/funk band, formed out of a group of college acquaintances from the University of Chicago.   The band consists of Jason Packer, Daraka Kenric, Larimore-Hall, Jessica Basta, Matt Parker,  Rench, and several dozen friends and guests. 

The Adjusters' style fuses many genres, from ska to funk, reggae to soul, witha bit of jazz.  The tempo of their music ranges from the upbeat anthem Armstrong <a href=""https://www.last.fm/music/The+Adjusters"">Read more on Last.fm</a>",9981,80386,Stubborn All-Stars
The Senior Allstars," <a href=""https://www.last.fm/music/The+Senior+Allstars"">Read more on Last.fm</a>",3432,42207,Dubvisionist
Los Skagaleros," <a href=""https://www.last.fm/music/Los+Skagaleros"">Read more on Last.fm</a>",1218,8263,Alla Spina
The Stingers ATX,"The Stingers ATX are a traditional ska band from Austin, TX. They have been around for a long time and gone through many lineup changes. Their trombone player got his undergrad and masters degrees in trombone performance. <a href=""https://www.last.fm/music/The+Stingers+ATX"">Read more on Last.fm</a>",3824,53345,Crazy Baldhead
J. Navarro & The Traitors,"Jay Navarro (The Suicide Machines, Break Anchor, Hellmouth) and Eric Abbey (1592) came together to write and record some of the music that they love. <a href=""https://www.last.fm/music/J.+Navarro+&+The+Traitors"">Read more on Last.fm</a>",560,3501,no data
The Aggrolites,"The Aggrolites are a reggae band from Los Angeles, California. The Aggrolites are an amalgamation of two previous Los Angeles reggae and ska bands, the Vessels and the Rhythm Doctors, and were originally formed in 2002 as an in-concert backing band for reggae icon Derrick Morgan. The band were asked to record music for a new album for Morgan, and though the actual project was never released, the recording sessions inspired the Aggrolites to become a permanent band. <a href=""https://www.last.fm/music/The+Aggrolites"">Read more on Last.fm</a>",125332,2607809,The Slackers
Western Standard Time Ska Orchestra," <a href=""https://www.last.fm/music/Western+Standard+Time+Ska+Orchestra"">Read more on Last.fm</a>",1795,19189,The Steady 45's
Left Alone,"Left Alone is a Ska Punk band from Wilmington, California. They were formed in May 1996 by lead vocalist/guitarist Elvis Cortez. Cortez formed his own label, Smelvis Records, to release Left Alone's records, and has since expanded the label to include numerous other underground bands. Cortez was also the owner of the PCH Club in Wilmington, which is now defunct. Left Alone's music has ska influences, and the band is notable for adhering to a do it yourself ethic <a href=""https://www.last.fm/music/Left+Alone"">Read more on Last.fm</a>",65292,783437,Street Dogs
Buck-O-Nine,"Buck-O-Nine formed in a small warehouse in the early part of 1991. Based in San Diego, the band was on the horizon of a change in the music industry. At the time the catch phrase was “Grunge.” The band was eager to take a different path. With their backgrounds in Punk/Metal bands, Reggae bands and 2nd wave Ska bands, Buck-O-Nine had the formula for what was to become a new mutation of sounds. Inspired by the early founders of this new sound, Buck-O-Nine admired the works of Fishbone <a href=""https://www.last.fm/music/Buck-O-Nine"">Read more on Last.fm</a>",133934,1224833,Mustard Plug
The JB Conspiracy,"The JB Conspiracy formed late in 1999 in Guildford, Surrey. 

They fused influences from some of their favourite bands (Less Than Jake, The Specials, Catch 22, RX Bandits) with their own style and after a few line up changes became the band they are today. Shows and tours with the likes of The Slackers, Capdown, Slow Gherkin, Adequate Seven and Streelight Manifesto saw them polish their live show and gain a reputation for a crowd of skankers wherever they went. <a href=""https://www.last.fm/music/The+JB+Conspiracy"">Read more on Last.fm</a>",28545,441900,Catch-It Kebabs
The Skariginals,"Forged by musical soul mates Ryan Mowrey and Brayden Wiggins, The Skariginals were created to lift you up through song, dance, laughter and love. Their popsteady sounds drawn from ska, reggae, pop, and rock influences are here to make you dance, sing along and feel good. Whether you're listening to their records or experiencing one of their high-energy live shows you're gonna have a good time. Whether you play their songs for your three-year-old niece <a href=""https://www.last.fm/music/The+Skariginals"">Read more on Last.fm</a>",361,1850,The Last Slice
The Prizefighters,"THE PRIZEFIGHTERS are Minnesota's first and only Traditional Ska, Rocksteady, and Skinhead Reggae band. The band started out as a solo project of Aaron Porter, aka Lord Grab and Flee in 2004. After a few years of recording all the tracks and playing all the instruments, THE PRIZEFIGHTERS came together in 2006. Matt Morse and Jordan Porter enlisted from Aaron's other band, GYLBOTS. Tim (Tooth) Freeman stepped up to the drums, quickly learning the Jamaican drumming styles essential to playing Traditional Jamaican music. <a href=""https://www.last.fm/music/The+Prizefighters"">Read more on Last.fm</a>",1027,15568,The Steady 45's
Two Tone Club,"Depuis l'an 0, naissance de l'Original Ska Band, Two Tone Club sillonne l'Europe et distille à travers des prestations live explosive, une musique d'inspiration jamaïcaine aux accents british. Enflammant la plage des eurockéennes en 2004, les 9 RudeBoys viennent de sortir un album haut en couleur ""TURN OFF"". <a href=""https://www.last.fm/music/Two+Tone+Club"">Read more on Last.fm</a>",16736,128345,No Sports
Save Ferris,"The band formed in 1995 after the dissolution of a number of Southern California third-wave ska bands. Los Pantelones members Brian Mashburn (guitar/vocals), Bill Uechi (bass), Eric Zamora (saxophone), and José Castellaños (trumpet) joined with Larry vocalist Monique Powell, Nuckle Brothers trombonist Brian ""T-Bone Willy"" Williams, and drummer Marc Harismendy to form Save Ferris, whose name was taken from the John Hughes film Ferris Bueller's Day Off. <a href=""https://www.last.fm/music/Save+Ferris"">Read more on Last.fm</a>",234785,2652646,Dance Hall Crashers
The Slackers,"  One of New York's most notable ska bands, the Slackers formed in Brooklyn in 1991 and have played the world over many times since.  Their first release was an eponymous self-released album, distributed by Moon Records in 1993 on cassette. Their first real debut is ""Better Late Than Never"" on Moon Ska Records. Coming out in 1996, this album saw a movement to more traditional ska music, as opposed to their earlier two-tone and garage influences. It was produced by Victor Rice <a href=""https://www.last.fm/music/The+Slackers"">Read more on Last.fm</a>",160176,4348261,The Pietasters
Ruder Than You,"RUDER THAN YOU was founded in 1989 by five students at Penn State University who relocated to Philadelphia in 1991. Long known as Philly’s top ska band, Ruder Than You’s identity has never fit too neatly into any of the generic ska categorizations. While ska and reggae stylings have always provided the common musical thread, they're know for mixing in dancehall reggae, hip-hop, rocksteady, and rub-a-dub, even adding elements of funk, jazz, and punk - to create their own unique sound. <a href=""https://www.last.fm/music/Ruder+Than+You"">Read more on Last.fm</a>",15705,75503,Skavoovie & The Epitones
OMNIGONE,"OMNIGONE is Adam Davis (LINK 80, DESA, GNARBOOTS) with a rotating line-up of ex-bandmates & close friends. <a href=""https://www.last.fm/music/OMNIGONE"">Read more on Last.fm</a>",4474,84034,JOYstick!
Skaters,"SKATERS formed in late 2011 after Singer Michael Cummings and Noah Rubin (The Dead Trees, Adam Green, Little Joy) spent a year trading demos back and forth from Los Angeles to London with Guitarist Joshua Hubbard (The Paddingtons, Dirty Pretty Things). The three met in the middle to record an EP in a Manhattan loft, and never left the city. The result is a smart, dynamic punk record drawing inspiration from obscure genres and cultures. And, a live <a href=""https://www.last.fm/music/Skaters"">Read more on Last.fm</a>",81081,735953,no data
The Doped up Dollies," <a href=""https://www.last.fm/music/The+Doped+up+Dollies"">Read more on Last.fm</a>",1119,13254,no data
Ska Sound System," <a href=""https://www.last.fm/music/Ska+Sound+System"">Read more on Last.fm</a>",94,9176,Porkpie
Tim Timebomb,"Tim Timebomb is a music project by Tim Armstrong, best known as a member of the punk rock band Rancid. Armstrong has recorded a large number of songs – a mixture of cover versions, including Rancid covers, and original songs, including some tracks from his musical film project RocknNRoll Theater – with a variety of supporting musicians.

A selection of the material was first released as a download only album Tim Timebomb Sings Songs from RocknNRoll <a href=""https://www.last.fm/music/Tim+Timebomb"">Read more on Last.fm</a>",22296,676382,Tim Armstrong
South Central Skankers,"The South Central Skankers Rise from Lost Angeles

Their unique and upbeat sounds attract people of all ages and from all walks of life. The Skankers create a sound that cannot be ignored by combining ska, punk, metal and Latin. Their influences vary from underground to highly established bands, many of which were born out of Los Angeles. 

The Skankers first joined forces in 2002 and in the fall of 2003, they went to the studio to record their first L. <a href=""https://www.last.fm/music/South+Central+Skankers"">Read more on Last.fm</a>",4550,38863,8 Kalacas
The 5th Wave," <a href=""https://www.last.fm/music/The+5th+Wave"">Read more on Last.fm</a>",143,956,Molestia 415
BLACK GET TO," <a href=""https://www.last.fm/music/BLACK+GET+TO"">Read more on Last.fm</a>",1,27,no data
Pulley,"Pulley is a Southern California punk rock formed in 1994. The band is known for straight-forward, hard-edged melodic punk. Pulley was formed upon vocalist Scott Radinsky's departure from Ten Foot Pole, brought about by that band's desire for a singer with a full-time focus on music (Radinsky is also a famous major-league relief pitcher and has played for the Los Angeles Dodgers among others). Pulley's initial lineup included drummer Jordan Burns, guitarist Jim Cherry, guitarist Mike Harder, and former Face to Face bassist Matt Riddle. <a href=""https://www.last.fm/music/Pulley"">Read more on Last.fm</a>",179508,2722629,Ten Foot Pole
Kalles Kaviar,"A Swiss ska group est. 1995 in the city of Basel.
 <a href=""https://www.last.fm/music/Kalles+Kaviar"">Read more on Last.fm</a>",2494,43123,Open Season
Catbite,"We're 4 friends who love 60's Jamaican music, 50's Rock and Roll, Two-tone, Punk rock, and everything in between. <a href=""https://www.last.fm/music/Catbite"">Read more on Last.fm</a>",12868,252130,BAD OPERATION
The Pietasters,"In 1990, a bunch of punk, mod, and skinhead-types, among them Stephen Jackson, Chris Watt, Ben Gauslin, and Tom Goodin, were attending college in central Virginia. They soon discovered they shared the same love for punk, ska, soul, and reggae music. They decided to form a punk rock cover band, The Slugs, whose initial forays were disappointing.

Soon after, a mutual friend, Tal Bayer moved in. He was very much into ska and reggae and suggested that the band play some of the catchy songs that they loved to drink to. <a href=""https://www.last.fm/music/The+Pietasters"">Read more on Last.fm</a>",91231,1055988,The Toasters
Stop the Presses,"Hialeah, FL ska/reggae/rocksteady. New EP ""Eskandalo"" out now, full US tour March 2014. Ruuuuuuuude. https://www.facebook.com/StopThePressesMusic <a href=""https://www.last.fm/music/Stop+the+Presses"">Read more on Last.fm</a>",1929,17014,Hans Gruber And The Die Hards
Melbourne Ska Orchestra,"An explosive celebration of music unfolds on stage with some of Australia’s finest musicians, when the 30 od piece orchestra hit the stage. Imagine the force of an 18 piece horn section, a mean rhythm section, percussionist, organist and 3 singers and you may only begin to understand the life force that is the Melbourne Ska Orchestra.

Fronted by Nicky Bomba (Bomba, John Butler Trio), with his professional, fun and impulsive conducting style, Melbourne <a href=""https://www.last.fm/music/Melbourne+Ska+Orchestra"">Read more on Last.fm</a>",10921,125766,St. Petersburg Ska-Jazz Review
Dakka Skanks,"Since their formation in 2016, and with an album and several single releases under their belt, Dakka Skanks have been continuously picking up live shows from promoters across Europe, the first Spanish mini-tour of the Madrid area generated more offers including shows across Germany, France, Belgium and Spain. 2018 brought shows with Madness, Neville Staple, The Skatalites, headline slots across the UK and the rest of Europe and 2019 onwards has seen more extensive European touring <a href=""https://www.last.fm/music/Dakka+Skanks"">Read more on Last.fm</a>",803,7983,Death Of Guitar Pop
Imperial Leisure,"A North London, UK band born from high school friendship, with a shared admiration of groups, both close to home, such as The Specials / Madness, & from further afield, such as The Beastie Boys / Jurassic 5 & Rage Against The Machine. Their fan-base built through gigging has paid off with their debut single - In A Letter - selling-out, on the day of release. Radio support for the band has been extensive, with singles getting plays by Zane Lowe & Colin Murray (BBC Radio One) <a href=""https://www.last.fm/music/Imperial+Leisure"">Read more on Last.fm</a>",15784,279385,The JB Conspiracy
Green Room Rockers,"THIS IS FROM INDIANA? yep....from NWI to indy all the way to the tip of the boot. We are proud to rep that Hoosier Homegrown. GRR mixes the Bass Heavy sounds of Jamaica from its original golden era with All-American Soul. Its boot stompin, finger snappin music for those whole like the small axe sharp and ready. The versatility of the music allows GRR to play alongside anything from country western to punk, and still get them feet movin. thanks for stoppin by, and come say hi at our next stage show! <a href=""https://www.last.fm/music/Green+Room+Rockers"">Read more on Last.fm</a>",4241,52555,The Forthrights
Dropcase," <a href=""https://www.last.fm/music/Dropcase"">Read more on Last.fm</a>",407,3844,Hooray for Our Side
Revancha Ska," <a href=""https://www.last.fm/music/Revancha+Ska"">Read more on Last.fm</a>",27,206,Undisputed World Champions
Reel Big Fish,"Reel Big Fish (""RBF"") is a ska punk band from Huntington Beach, California, United States who broke into the mainstream in the mid to late 1990s, formed in 1992. 

Their debut album, ""Everything Sucks"" (1995), was an underground hit and led to a deal with Mojo Records (see also Mojo), an indie label. ""Turn the Radio Off"" (1996) established the band in the underground music scene, and they began touring throughout the USA. After the single ""Sell Out"" began breaking into the mainstream, including MTV, the album made an appearance on the charts. <a href=""https://www.last.fm/music/Reel+Big+Fish"">Read more on Last.fm</a>",881653,26954256,Suburban Legends
Grey Matter,"Grey Matter is a Michigan Ska-core band
https://greymattermi.bandcamp.com/ <a href=""https://www.last.fm/music/Grey+Matter"">Read more on Last.fm</a>",5711,87360,The Best of the Worst
The Debonaires,"There are many different bands named The Debonaires.

1. The Debonaires originated from the Southern California traditional ska revival subculture that developed and thrived throughout the Los Angeles and Inland Empire regions in the 1990’s. Their unique rendition of Jamaican ska is not only reminiscent of legendary performers such as The Skatalites, but also embodies a soulful element heavily influenced by early American R&B and soul.

The group’s dynamic 15 year history began in Riverside, California in 1995. <a href=""https://www.last.fm/music/The+Debonaires"">Read more on Last.fm</a>",12687,75809,Stubborn All-Stars
Something to Do,"Genre: Ska (Horn-Driven Rock And Ska)
Hometown: Waukesha, Wisconsin

Joe Abbott: Trumpet, 
Mike Batzler: Drums, 
Nate Tredinnick: Vocals & Bass, 
Marc Kuntz: Trombone, 
Ken Maciejewski: Vocals & Guitar 
Alex Kayser: Guitar

Formed from the ashes of 2 Wisconsin ska bands (Vitamin King and the Straight Edge Crack Whores), they got together just for something to do. When it came time for a band name, this made the most sense. <a href=""https://www.last.fm/music/Something+to+Do"">Read more on Last.fm</a>",4715,61439,Backyard Superheroes
Upground,"Upground is the young vibrant East L.A. band that has developed a huge following throughout the Southwest in the four short years they have been performing live. Their music is an indefinable blend of Ska, reggae, rock, and CUMBIA! It is sung in Spanish AND English. Their amazing horn section has been widely praised by everyone from the L.A. Times to Tu Ciudad magazine. They recently released their debut full length CD called “Feel the Vibe” which received widespread critical acclaim. <a href=""https://www.last.fm/music/Upground"">Read more on Last.fm</a>",1016,3384,Charanga Cakewalk
Anti-Flag,"Anti-Flag was an American punk rock band from Pittsburgh, Pennsylvania, United States. The band is well known for its politically charged lyrics and activism, focusing on human rights and various left-wing causes. The line-up includes singer/guitarist Justin Sane and drummer Pat Thetic, who founded the band together; later members are guitarist Chris Head, and singer/bassist Chris Barker (#2) who replaced Jamie ""Cock"" Towns, who had replaced original bassist Andy Flag in 1997 following his departure one year prior. <a href=""https://www.last.fm/music/Anti-Flag"">Read more on Last.fm</a>",935676,32627684,Pennywise
The Trojans,"Specialising in ska & reggae with a dash of soul, funk, R&B & world roots, The Trojans were formed in late 1986 from the ashes of the premature demise of Gaz Mayall's first band Gaz's Rebel Blues Rockers. (Gaz is the eldest son of Blues legend John Mayall)

Debut gig was the Astoria on Charing Cross road by London's center point on the 23rd December 1986 supporting premier ska band Potato 5 and ska legend Laurel Aitken. Within two and a half years the Trojans headlined the same venue with the above acts supporting them. <a href=""https://www.last.fm/music/The+Trojans"">Read more on Last.fm</a>",12207,140356,The Ska Flames
The Skashank Redemption," <a href=""https://www.last.fm/music/The+Skashank+Redemption"">Read more on Last.fm</a>",1738,12320,Be Like Max
O.C. Ska Kids," <a href=""https://www.last.fm/music/O.C.+Ska+Kids"">Read more on Last.fm</a>",2378,15486,Dropcase
The English Beat,"The Beat, known in the United States and Canada as The English Beat (and the British Beat in Australia and New Zealand) in order to avoid confusion with Paul Collins' band of the same name, was a popular Two Tone ska and pop music group. Formed in the English city of Birmingham in 1978, The Beat disbanded in 1983, but has reformed in the early 2000s with some of the original line-up.
One of the more popular and enduring groups of a short-lived trend <a href=""https://www.last.fm/music/The+English+Beat"">Read more on Last.fm</a>",206166,2319003,General Public
Vic Ruggiero,"Vic Ruggiero is a ska, reggae, blues musician of Italian heritage from Bronx, New York. He now lives in New Jersey.

Next to being the singer, organist and songwriter of The Slackers, he is/was involved in various projects like The SKAndalous All-Stars or The Stubborn Allstars. 

For many years, Vic has also nurtured a dusty alt country/blues/rock solo project.

He's recorded a slew of solo albums on which he mainly plays the guitar, harmonica and percussion.  <a href=""https://www.last.fm/music/Vic+Ruggiero"">Read more on Last.fm</a>",19370,433522,Stubborn All-Stars
The Skatalites,"The Skatalites are a Jamaican music group that played a major role in popularising ska, the first truly Jamaican music created by fusing boogie-woogie blues, rhythm and blues, jazz, mento, calypso, and African rhythms. They recorded many of their best known songs, including Guns of Navarone, in the period between 1964 and 1965, as well as played on records by Prince Buster and many other Jamaican artists.

The founding members of the group were Tommy McCook <a href=""https://www.last.fm/music/The+Skatalites"">Read more on Last.fm</a>",350898,5122039,Don Drummond
The Dualers,"The Dualers are street performing brothers Si and Tyber.

The Dualers perform a unique blend of ska, soul and reggae that appeals to all ages with members of their database ranging from 1 to 91. They have a fan base of approaching 10,000 members but have probably been seen by in excess of 4 million whilst busking around the south east and performing at private functions, for the last 8 years. They have sold over 35,000 copies of their first two cd's on the streets alone. <a href=""https://www.last.fm/music/The+Dualers"">Read more on Last.fm</a>",10416,149019,Pressure Cooker
Skablins,"Skablins is a ska band formed in May 2007 from Arlington, Washington with Gordy Whyte (vocals), Joe Brimhall (guitar), Heather Beck (saxophone), Dylan Carolus (trombone), Anthony Beck (bass), Prosperity Israel (drums), and Ben Curley (keyboard); successor to their counterpart, the late Los Kakadots band. They are a high-energy party band suited for hoppin' fun with vibes of Latin twist to add to the dancy zest. See them play at the Mirkwood & Shire Cafe ""The Mirk"" in downtown Arlington, their personal home venue. <a href=""https://www.last.fm/music/Skablins"">Read more on Last.fm</a>",100,709,The Crombies
Skankin' Pickle,"Skankin' Pickle was a San José based ska punk sextet during the late 1980s and early 1990s. Formed in 1989, they released several LPs, mostly on their own record label, Dill Records. Members included vocalist/saxophonist Mike ""Bruce Lee"" Park, guitarist Lynette Knackstedt, bassist Ian Miller, bassist Mike Mattingly, trombonists Lars Nylander and Gerry Lundquist, and drummer Chuck Phelps. Their music includes metal, dub, swing, and New Wave elements. <a href=""https://www.last.fm/music/Skankin%27+Pickle"">Read more on Last.fm</a>",83034,859906,Mustard Plug
Mephiskapheles,"Leading the charge of the New York City ska revival scene, Mephiskapheles was formed in the East Village in 1990 by lead vocalist the Grand Invidious, guitarist Brendog and keyboardist Brian Martin. Within the course of the following months, the group's classic lineup -- also consisting of bassist Michael Bitz, trumpeter Osho Endo, alto saxophonist Alexander McCabe, and trombonist Greg Robinson -- was firmly in place, and over the next few years Mephiskapheles toured relentlessly up and down the East Coast, building a tremendous cult following. <a href=""https://www.last.fm/music/Mephiskapheles"">Read more on Last.fm</a>",30747,347767,Skankin' Pickle
Phoenix City All-stars," <a href=""https://www.last.fm/music/Phoenix+City+All-stars"">Read more on Last.fm</a>",1419,12430,SKAndalous All-Stars
Skinnerbox,"There are 3 groups names Skinnerbox:

1) Skinnerbox is a third wave ska band formed in New York City in the early 1990s by King Django.

2) Also, it is a Producer and Liveact Duo from Berlin, playing Minimal Techno & Experimental House.

3) There is another band called Skinnerbox. Hailing from the Netherlands.
noise/alternative/visual/experimental 

Find out which one matches your needs.... <a href=""https://www.last.fm/music/Skinnerbox"">Read more on Last.fm</a>",22204,108220,Stubborn All-Stars
Let's Go Bowling,"Let's Go Bowling is a Third Wave Ska band hailing from the Greater San Joaquin Valley. Since the band's inception in 1986, the band's traditional ska style, barbershop harmonies, wisely crafted instrumentals, and its frantic live performances, helped set the standard for dress and culture for West Coast Ska, which in turn, set the groundwork for the Third Wave Movement in 1995. <a href=""https://www.last.fm/music/Let%27s+Go+Bowling"">Read more on Last.fm</a>",23331,172033,Bim Skala Bim
SKAndalous All-Stars,"A late 1990's New York City based loose aggregation of Ska musicians, including members of The Slackers, Mephiskapheles, the Stubborn All-Stars, Ruder Than You, Agent 99, the Cycle Sluts From Hell, and the Klezmatics. The group performed some originals on their 1999 album The Age of Insects but were better known for earlier amusing covers of non-ska type music including songs by Kiss, Blondie, White Zombie and the Breeders as heard on their first two albums Hit Me (1997) and Punk Steady (1998). <a href=""https://www.last.fm/music/SKAndalous+All-Stars"">Read more on Last.fm</a>",6304,67178,Stubborn All-Stars
The Best of the Worst,"2005-Present

The Best of the Worst is a ska/hardcore/punk band from New Jersey.

Stream and Download their music for free at tbotwnj.com. 

Download their new full length ""Perspectives"" at www.communityrecords.org.

Pick up some merch at tbotw.bigcartel.com

facebook.com/thebestoftheworst
instagram @thebestoftheworstnj
tbotwnj.tumblr.com <a href=""https://www.last.fm/music/The+Best+of+the+Worst"">Read more on Last.fm</a>",7913,157382,Hans Gruber And The Die Hards
