Artista,Biografia,Listeners,Playcount,Artistas Similares
UNRB,"Hailing from St. Petersburg FL, UNRB uses an electric ukulele and 
a 4-piece horn section to create a fusion of ska, rock and jazz that 
has proven tremendously popular with teens and adults alike (and even a few grandmas!). As a band that takes themselves ""just seriously enough, ""their live shows involve plenty of onstage antics, instrument changes, and a healthy dose of crowd interaction. It's this combination of talent and offbeat humor that has <a href=""https://www.last.fm/music/UNRB"">Read more on Last.fm</a>",1108,9097,Victims Of Circumstance
The Inevitables,"There are al least 2 bands with the name ""The Inevitables"".  

1.  An unsigned four piece funk-rock band based in Glen Waverley, VIC Australia. Formed from the remains of The Whoremoans, a short-lived project that consisted of William Boffa, Rohan Gilham and Steven Homer. The group disbanded when Homer relocated to Canada due to his father's work position. 
The band's current lineup consists of Tim Morton, Lincoln McGreggor-Smith, Gilham and Boffa. All of the band's members attend/have attended Huntingtower School in Mt. Waverley. <a href=""https://www.last.fm/music/The+Inevitables"">Read more on Last.fm</a>",2400,26942,Stop the Presses
Tokyo Ska Paradise Orchestra,"In the late 1980s, there was a band executing countless lives on streets and clubs of Tokyo…, their　name is TOKYO SKA PARADISE ORCHESTRA. Their dynamic yet absolute performance drew growing audiences, and so releases the first 12' vinyl record ""TOKYO SKA PARADISE ORCHESTRA"" from an indie label in 1989. The following year, gaining more and more fans, they make a major debut by the single ""MONSTER ROCK,"" and its recorded album ""SUKAPARA TOU-JYO. <a href=""https://www.last.fm/music/+noredirect/Tokyo+Ska+Paradise+Orchestra"">Read more on Last.fm</a>",38010,546792,no data
Some Ska Band," <a href=""https://www.last.fm/music/Some+Ska+Band"">Read more on Last.fm</a>",242,1592,The Abruptors
Dang!t," <a href=""https://www.last.fm/music/Dang%21t"">Read more on Last.fm</a>",254,1206,Hans Gruber And The Die Hards
Ska Makers," <a href=""https://www.last.fm/music/Ska+Makers"">Read more on Last.fm</a>",63,381,Western Special
The Planet Smashers,"Formed in 1994 in Montreal, Quebec, the Planet Smashers’ infectious pop infused melodies, rippin’ horn licks and killer live shows, quickly established them as the city’s “Kings of Ska”. They released their first album (“Self-Titled”) on Planet Smasher’s founder Matt Collyer’s own label STOMP Records and hit the road. By 1997 they were no longer a local band, but a national phenomenon, headlining shows across Canada and pushing their second record <a href=""https://www.last.fm/music/The+Planet+Smashers"">Read more on Last.fm</a>",153123,2786679,Big D And The Kids Table
4 Point 0,"4 Point 0 is a Ska/Rock band from Syracuse, NY! They have toured the Eastern US during each summer and winter since 2010, and have played with international touring acts such as Big D and the Kids Table, The Toasters, Mustard Plug, The Pietasters and Flatfoot 56. 4 Point 0 blends traditional third wave ska music with influences of rock, punk, jazz, funk, hardcore, and even classical music. The band is known for its incredible energy and stage presence, as well as its catchy melodies and tight 4-man horn line. <a href=""https://www.last.fm/music/4+Point+0"">Read more on Last.fm</a>",1407,14458,Behind Deadlines
The Selecter,"The Selecter, a ska revival band from Coventry, England, formed in the late 1970s as one of the essential bands of the British ska movement. The profilic lead singer is Pauline Black. The Selecter are known for hits as 'On My Radio', 'Too Much Pressure', 'Missing Words', 'Three Minute Hero' and 'Celebrate The Bullet'. The Selecter featured a racially mixed line up, and the name of the band is a reference to the Jamaican word for a music selecter, known elsewhere as the DJ. <a href=""https://www.last.fm/music/The+Selecter"">Read more on Last.fm</a>",201474,1915971,The Specials
Deal's Gone Bad,"What do you get when you mix the chugging rhythms of Jamaica, the energy and emotion of American Motown, and the overthe-top pub/rock of the Pogues? Now in their 14th year, Deal’s Gone Bad is touring extensively with its strongest and most consistent line-up in its history. With elements of ska, rocksteady, reggae, and American soul, DGB is sure to please on the dancefloor as well as on their fourth release to date, “The Ramblers” on Megalith and Jump Up! Records (March, 2007). <a href=""https://www.last.fm/music/Deal%27s+Gone+Bad"">Read more on Last.fm</a>",26689,311879,Stubborn All-Stars
The Villains,"Coming off the success of their 2010 debut album ‘Just Another Saturday Night’, The Villains return with their sophomore release, ‘Velocity’. Produced by Stan Lynch (Tom Petty and the Heartbreakers, Don Henley) and Billy Chapin (Backstreet Boys, Edwin McCain) and mixed by industry veteran John Kurzweg (Jewel, Creed), the 12 new songs on ‘Velocity’ mark the tremendous growth of the band in the last year and a half. The songs run the gambit of experiences and emotions.   <a href=""https://www.last.fm/music/The+Villains"">Read more on Last.fm</a>",2966,23196,Kingsfoil
Prince Buster,"Prince Buster (Cecil Bustamente Campbell, 24 May 1938 - 8 September 2016) was a Jamaican singer, songwriter and producer. He is regarded as one of the most important figures in the history of ska and rocksteady music. The records he released in the 1960s influenced and shaped the course of Jamaican contemporary music and created a legacy of work that later reggae and ska artists would draw upon.

Born Cecil Bustamente Campbell on Orange Street in Kingston <a href=""https://www.last.fm/music/Prince+Buster"">Read more on Last.fm</a>",180085,1587249,Derrick Morgan
Time Again,"Time Again are a punk rock band from Los Angeles, California. The band was formed in the summer of 2004 by vocalist Daniel Dart and guitarist Elijah Reyes. Before they even had a full band or a single song written, they began printing stickers and flyers for Time Again to heavily promote their band, resulting in numerous shows being booked. Time Again only came together as a full band a few days before their first show, with Brian Burnham and Ryan Purucker joining on bass guitar and drums. <a href=""https://www.last.fm/music/Time+Again"">Read more on Last.fm</a>",47041,579452,Roger Miret and the Disasters
Rude Tins,"Lineup

Thomas Eichmann / Vocals
Claudia Widmer / Alto-Sax / Keys / Backing Vocals
Raphael Grüter / Tenor-Sax
Yves Jung / Trumpet
Christian Steiner / Trombone
Yves Blösche / Guitar
Fabian Arnold / Bass
Jonas Oeschger / Drums


Biographie

2002 Im Frühling beginnen Thomas Eichmann (Gitarre und Gesang) und Fabian Arnold (Bass) mit ersten Proben und der Suche nach weiteren Musikern. Im Sommer stösst Jonas Oeschger (Schlagzeug) zur Band. Das Repertoire besteht zu dieser Zeit aus Coversongs im Punk- und Rockbereich. <a href=""https://www.last.fm/music/Rude+Tins"">Read more on Last.fm</a>",6147,42242,Just Say Nay
[spunge],"spunge are a ska punk band from Tewkesbury, England. The lead singer, Alex Copeland, has commented that the brackets are in the name so that the letters don't fall out. The correct name does not capitalise the 'S', probably for aesthetic reasons. spunge are the only band who has ever officially been given permission by the Marley family to change the lyrics of a Bob Marley song, on their cover of ""No Woman, No Cry"" (this can be found on their second album, Room For Abuse). <a href=""https://www.last.fm/music/%5Bspunge%5D"">Read more on Last.fm</a>",56595,820507,The Holophonics
Pilfers,"Pilfers formed in 1997, when former Toasters vocalist, Coolie Ranx joined with former Bim Skala Bim trombonist, Vinny Nobile. To complete the lineup, they recruited the Skinnerbox rhythym section of Anna Milat-Meyer, on bass and James Blanck, on drums, as well as guitar player, Nick Bacon, of The Erratics.

The band released one demo tape and played many New York area shows, before self releasing their debut, self-titled album, in 1998. Response was positive enough <a href=""https://www.last.fm/music/Pilfers"">Read more on Last.fm</a>",5958,114071,Spring Heeled Jack
Slow Gherkin,"Slow Gherkin was a ska band from Santa Cruz, US. The group disbanded after many years of local shows and a tour to Japan. <a href=""https://www.last.fm/music/Slow+Gherkin"">Read more on Last.fm</a>",19251,211513,Rudiments
Hepcat,"Hepcat are a third wave ska band formed in southern California in 1989.

Their soulful harmonies and mellow rhythms were unlike those of contemporaries and more akin to musicians from the heyday of 1960s Jamaican ska, also referred to as the first wave.

Hepcat's debut album, ""Out of Nowhere"" was released in 1994 on New York-based ska label Moon Records. Two years later, they followed it up with ""Scientific"" on BYO Records. In 1998, after signing with Epitaph Records subsidiary HellCat Records <a href=""https://www.last.fm/music/Hepcat"">Read more on Last.fm</a>",95454,1204659,The Slackers
The MFA,"The MFA (or Motherfucking Allstars) are Rhys Evans (Welsh) and Alastair Douglas (not Welsh), a live dance duo from London and Wales who stand first in line to the throne at the head of the UK live dance duo dynasty. Lofty aspirations indeed, but with repeated comparisons to the giants of dance music like The Chemical Brothers, Daft Punk, The Prodigy, Orbital and Underworld echoing from all corners whenever The MFA are in town, their ambition would appear not to be misplaced. <a href=""https://www.last.fm/music/The+MFA"">Read more on Last.fm</a>",50094,239088,Zeta Reticula
The Freecoasters,"Reggae and Soul from Fort Myers, FL.
Members:
Claire Liparulo - Vocals, Guitar,
David Boyko - Organ, Keys,
Saul Catacora - Guitar, 
Scott Martin - Drums,
John Schiller - Bass <a href=""https://www.last.fm/music/The+Freecoasters"">Read more on Last.fm</a>",365,3611,The Loving Paupers
Voodoo Glow Skulls,"Voodoo Glow Skulls are an underground third-wave ska band. Their music is a mixture of old-style ska, punk and metal. The band formed in 1988 in Riverside, California by brothers Frank, Eddie and Jorge Casillas and their longtime friend Jerry O'Neill. The Voodoo Glow Skulls practiced for two years in a sweaty back bedroom/practice space until they forged a taut unit that performed with demonic intensity and a demented sense of humor. Backyard parties <a href=""https://www.last.fm/music/Voodoo+Glow+Skulls"">Read more on Last.fm</a>",192064,2724145,Skankin' Pickle
Fink's Constant," <a href=""https://www.last.fm/music/Fink%27s+Constant"">Read more on Last.fm</a>",223,1808,The Wedgewoods
The Fuss,"There is more than one artist with this name.

1) The Fuss is a young swinging poprock band from Holland. Hugo den Hartog is the lead vocalist and provides the band with a lot of energy. Followed by Dirk Voets, playing an unusual instrument for a poprock band - the saxophone.   Lead guitarist is Jeroen Straatman, backed up by Matthijs van der Wielen on rhythm guitar. Rens Spierings offers the bass licks and Rob van Rumpt keeps the whole band together with his drums. <a href=""https://www.last.fm/music/The+Fuss"">Read more on Last.fm</a>",2573,14561,The Freecoasters
Faintest Idea,"Playing anywhere and everywhere from squats to bars to festival main stages and drawing inspiration from bands such as The Specials, The Filaments & Operation Ivy this is angry political commentary that you can shout along to while stomping your feet.
Faintest Idea take the bouncing beat of 2 Tone Ska and smash it over the head with fast, angry UK Punk. Hailing from the East Anglian region of Britain the rabble rousing political lyrics are shouted over layers of catchy brass lines and heavy boot stomping beats. <a href=""https://www.last.fm/music/Faintest+Idea"">Read more on Last.fm</a>",5640,118650,Tyrannosaurus Alan
Eastern Standard Time,"Put together top musicians from the Jazz and Reggae scenes, give them the recipie for the original Jamaican Ska, throw a dose of Soul in the mix and the result is Eastern Standard Time. From their initial days as a Be Bop influenced Ska-Jazz supergroup, the band has matured over more than a decade, adding Rocksteady, Reggae, Dub, Soul, and even Spy Jazz into their repertoire.

Eastern Standard Time is a world-renowned act, with multiple tours of The United States, Canada, Europe and Russia to their credit. <a href=""https://www.last.fm/music/Eastern+Standard+Time"">Read more on Last.fm</a>",14342,125178,Stubborn All-Stars
Kill Lincoln,"Kill Lincoln is a ska/punk band based in Washington, DC.  They have opened for such acts as Streetlight Manifesto, Westbound Train, Reel Big Fish, Less than Jake, Big D & The Kids Table, The Pietasters, The Slackers, and The Aggrolites. They look forward to playing your bar/basement/backyard in the future.  Current members include Mike Sosinski, Matt ""Food"" Ellis, Tyler Rodgers, Drew Skibitsky, Yasutaka Umemoto, CJ Uy <a href=""https://www.last.fm/music/Kill+Lincoln"">Read more on Last.fm</a>",21276,498912,We Are the Union
The Meddlers," <a href=""https://www.last.fm/music/The+Meddlers"">Read more on Last.fm</a>",916,2974,K-Man & The 45s
POTSHOT,"POTSHOT was formed in 1995 by vocalist and songwriter Ryoji Ariga. The band aims to play melodious, and sing-along ska punk with horns. They released their debut album POTS AND SHOTS in 1997 in both Japan and the U.S. on Asian Man Records, owned by Mike Park (The Chinkees, ex Skankin' Pickle). Ryoji started his own label TV-FREAK RECORDS. Their sophomore album Rock ’n’ Roll was released in 1998 and their 3rd album POTSHOT 'Til I Die in 1999 ( the Asian Man Records version was released in October 2000).  <a href=""https://www.last.fm/music/POTSHOT"">Read more on Last.fm</a>",32508,408115,no data
J Navarro & the Traitors," <a href=""https://www.last.fm/music/J+Navarro+&+the+Traitors"">Read more on Last.fm</a>",1236,14595,Hans Gruber And The Die Hards
Dissidente," <a href=""https://www.last.fm/music/Dissidente"">Read more on Last.fm</a>",1558,27276,Hans Gruber And The Die Hards
Bim Skala Bim,"Bim Skala Bim formed in Boston, Massachusetts in 1983, was one of America's initial responses to Britain's 2-Tone movement in the early '80s. They made several albums, started their own music label to release the music of other aspiring Ska bands, and remained active through 2002. Also inspired by the Clash, UB40 and Bob Marley, the group became one of the longest-lasting ska groups in America.

Formed by vocalist Dan Vitale and bassist Mark Ferranti <a href=""https://www.last.fm/music/Bim+Skala+Bim"">Read more on Last.fm</a>",27232,215440,Let's Go Bowling
Random Hand,"Random Hand is a four-piece ska-punk band from Keighley, West Yorkshire. Their sound fuses influences from many genres, including ska, reggae, punk, metal, hip hop and dub. After going on hiatus in 2015, the band returned in 2018.

Random Hand formed in late 2002, and consists of Joe Tilston (Bass & Vocals), Robin Leitch (Vocals & Trombone), Mathew Crosher (Guitar & Vocals) and Joe Dimuantes (Percussion & Samples). The four members came from three <a href=""https://www.last.fm/music/Random+Hand"">Read more on Last.fm</a>",37256,752508,King Prawn
Ska-J,"SKA-J play jazz music, interpreted in afro-jamaican style. The band live set is mostly acoustic, made up by voice (three singers), drums, guitar, double-bass, Hammond organ, two saxophones and a trombone. In the last two years Ska-j have enhanced the band with a female voice and the Hammond organ. SKA-J have been playing live on both local and national televisions (RAI, RockTv, Sky), various national and independent radio networks: the most important shows are several participations at Caterpillar’s events, a popular show on Rai RadioDue . <a href=""https://www.last.fm/music/Ska-J"">Read more on Last.fm</a>",5560,68016,royal roost
jer,"JER is a fresh new take on the sound of ska punk. Jeremy's inspiration comes from many ska bands old and new, such as Kill Lincoln﻿, Bruce Lee Band﻿, Hepcat﻿, The Skatalites﻿, and Fishbone﻿. While most Ska-Punk bands drive their ""Punk"" sound from the 90s pop punk style, JER seeks inspiration from modern ""indie"" punk bands such as Jeff Rosenstock﻿, Pup, Illuminati Hotties, Bad Moves, and The Beths. <a href=""https://www.last.fm/music/jer"">Read more on Last.fm</a>",23120,252625,We Are the Union
The Toasters,"The Toasters came out of the lower east side of Manhattan, New York in 1981. Cutting their teeth at legendary punk rock clubs such as CBGBs,  the band has proceeded  on to defy gravity and  industry skeptics alike by staying true to their original 2-Tone roots and earning their rightful place in the history of international ska music, particularly influential on ska punk.

In their role as consummate outsiders, the band has turned down major record deals and have opted instead to run down their own track where <a href=""https://www.last.fm/music/The+Toasters"">Read more on Last.fm</a>",207461,2976584,The Pietasters
Capdown,"Capdown are a band from Milton Keynes, United Kingdom. Originally known as Soap, their songs have political themes as alluded to by their name, which is short for Capitalist Downfall. Mixing ska, punk, hardcore, dub and reggae, Capdown built a reputation around their independent releases and numerous tours. Their debut album Civil Disobedients was released by London punk label Household Name Records in 2000, a year in which Capdown played nearly 250 gigs. <a href=""https://www.last.fm/music/Capdown"">Read more on Last.fm</a>",95179,1368966,Random Hand
Inspecter 7,"Inspecter 7's sound employs all three waves of Ska (Traditional, 2-Tone and 3rd Wave) and many outside influences spanning from Jazz to Oi!. This is easy to understand when you see the diverse line-up of band members, and easy to pick out when you hear their music. From hard stomping ragers to traditional instrumentals to swinging dance tunes, Inspecter 7's sound has something for every fan of Ska, and even those not so familiar with the music. 
 <a href=""https://www.last.fm/music/Inspecter+7"">Read more on Last.fm</a>",17740,172087,Hub City Stompers
The Ghetto On Phyre," <a href=""https://www.last.fm/music/The+Ghetto+On+Phyre"">Read more on Last.fm</a>",256,4484,Matamoska!
The Abruptors," <a href=""https://www.last.fm/music/The+Abruptors"">Read more on Last.fm</a>",1614,16517,Stop the Presses
Face to Face,"There are at least four artists named Face To Face:

1) Face to Face is a punk rock band from California. Formed in 1991, the group was initially signed by Dr. Strange Records, later moving to Fat Wreck Chords. Their first big hit ""Disconnected"" was played by KROQ and appeared in the movies Tank Girl and National Lampoon's Senior Class Trip. Their song ""Devil You Know (God is a Man)"" appeared in an episode of Buffy the Vampire Slayer (Season 1) and on the accompanying series soundtrack album. <a href=""https://www.last.fm/music/Face+to+Face"">Read more on Last.fm</a>",300141,6225411,Lagwagon
MU330,"MU330 (pronounced ""em-you-three-thirty"") are a ska/punk band formed in 1988 in Saint Louis, Missouri. The original members met in Saint Louis University High School music class 330 (hence the name of the band).

MU330's lineup has changed frequently, but the foundations of the band remained intact — Potthast, Diebold, Bell, and Moll.

The band is self-described as ""psycho ska"" and are known for their lively performances and a general ethic of fun and optimism. Their lyrics cover many topics, from racism to love songs to testicular cancer. <a href=""https://www.last.fm/music/MU330"">Read more on Last.fm</a>",110377,1163912,Mustard Plug
Skavoovie & The Epitones,"Formed during High School in Boston, Skavoovie and the Epitones was probably the youngest act to be signed to Robert ""Bucket"" Hingley's Moon Ska Record Label.  They were known for mixing ska with heavy swing and jazz influences to create a style that, while it echoed the first wave of ska, was uniquely their own.  They had only three albums out before they broke up, one with acclaimed ska producer, Victor Rice.  They were also sometimes the back-up band for ""Venice Shoreline"" Chris Murray. <a href=""https://www.last.fm/music/Skavoovie+&+The+Epitones"">Read more on Last.fm</a>",9070,71491,The Allstonians
SkaDaddyZ,"The SkaDaddyZ are a Ska band from Ventura, California. Ventura is north of L.A. and in between Santa Barbara and Santa Monica. 
Often compared to Sublime, the SkaDaddyZ describe their music as ""Skalternative, a new blend of Ska, Funk, Rasta, and Punk presented with extreme energy"".
Founded in 1993, they have gained quite a reputation overseas. They've shared stages with the likes Big Bad Voodoo daddy, The Artists, No Doubt and Save Ferris all over the west-coast. <a href=""https://www.last.fm/music/SkaDaddyZ"">Read more on Last.fm</a>",7692,57461,Ska Daddyz
Cut Capers,"Cut Capers are a 9-piece Bristol band whose energetic live performance and infectious sound have won them a cult following on the British festival scene. Mixing a swinging vintage-style brass section (think Caro Emerald) with funk, soul and hip-hop.
Like all the best bands, (and many of those on Freshly Squeezed Music) their sound is hard to pin down but comparisons have been made to “Madness, The Streets and Lily Allen” among many others (The Bristol Magazine). <a href=""https://www.last.fm/music/Cut+Capers"">Read more on Last.fm</a>",23014,184779,Little Violet
The Delegators,"The Delegators are an original rocksteady/soul/early reggae band from London, England. <a href=""https://www.last.fm/music/The+Delegators"">Read more on Last.fm</a>",5875,42570,Smooth Beans
Oi-SKALL Mates,"Oi-Skall Mates are a Japanese third-wave ska punk band from Tokyo, Japan. The band have played with bands such as Rude Bones and Kemuri in the J-ska scene, and have appeared on various compilations including both of the Japanese Disney cover albums by Walt Disney Records.

Band members>

    * Wataru Buster - vocals
    * Hiroshi ""Brown"" Buster - trombone
    * Ken Ken - guitar
    * Taeko - guitar
    * Yoshio - alto sax
    * Shintarou - tenor sax <a href=""https://www.last.fm/music/Oi-SKALL+Mates"">Read more on Last.fm</a>",10525,219762,Rude Bones
Chris Murray,"Chris Murray is a Canadian-born singer-songwriter and guitarist working primarily in the genre of ska. In Canada, he was a member of the now-defunct ska band King Apparatus. He now lives in the Los Angeles, California area, where he performs regularly, both solo as well as with the Chris Murray Combo.

Murray has performed throughout North America, Europe, Japan, and South America, and released several CDs on the Asian Man Records label. His CDs are often recorded with a four-track tape recorder, giving a distinctly lo-fi sound. <a href=""https://www.last.fm/music/Chris+Murray"">Read more on Last.fm</a>",34103,362486,Stubborn All-Stars
The Holophonics,"Eric Daino - Vocals, Guitar, Organ
Harrell Petersen - Vocals, Trumpet
Shane Robert Reider - Trombone
Tyler Waguespack - Bass
Will Huebner - Drums
Brian Handeland - Saxophones 

We play all the songs you love and all the songs you hate! Because every song sounds better as Ska and we intend to make you skank all night long! <a href=""https://www.last.fm/music/The+Holophonics"">Read more on Last.fm</a>",10997,172687,The Planet Smashers
Bad Manners,"Bad Manners are an English 2-Tone Ska band fronted by Buster Bloodvessel (born Douglas Trendle, 6 September 1958, in the borough of Hackney), and formed in 1976 at Woodberry Down Comprehensive School, North London, where the members studied. Reportedly, none of the eight members could play any instrument when they started.

The current line-up is :
Buster Bloodvessel - Vocals
Simon Cuell - Guitar
Lee Thompson -Bass
Richie Downs - Keyboards
Matt Goodwin - Sax
Matt Bane - Drums
Colin Graham - Trumpet
Russel Wynn - Percussion <a href=""https://www.last.fm/music/Bad+Manners"">Read more on Last.fm</a>",211856,2915457,The Beat
Skarlatines," <a href=""https://www.last.fm/music/Skarlatines"">Read more on Last.fm</a>",1489,9682,bluekilla
Mad Caddies,"The Mad Caddies are a ska punk band from Goleta/Santa Barbara/Solvang, USA. The band formed in 1995 and has released five full-length albums, one live album, and two EP's. Their sound has influences from a wide range of genres, including ska, punk, hardcore, swing, reggae and jazz.

Founding members Chuck Robertson, Sascha Lazor, Todd Rosenberg, Carter Benson and James Malis started the group in high school but the band's membership has changed frequently since its inception. <a href=""https://www.last.fm/music/Mad+Caddies"">Read more on Last.fm</a>",368232,10887745,Less Than Jake
Club Sandinista!,"Japanese ska group. <a href=""https://www.last.fm/music/Club+Sandinista%21"">Read more on Last.fm</a>",3061,12110,The Ska Vengers
Bruce Lee Band," <a href=""https://www.last.fm/music/+noredirect/Bruce+Lee+Band"">Read more on Last.fm</a>",16776,279435,no data
MxPx,"MxPx is a punk rock band that was formed in 1992 in Bremerton, Washington, United States.

MxPx started as three 15-year-old kids calling themselves Magnified Plaid pounding out music inspired by and similar to The Descendents and other Southern California punk rock bands. They didn’t really love their band name, however, which was a tribute to the original guitarist’s penchant for wearing one particularly loud plaid shirt. Consequently, the name was abbreviated to M. <a href=""https://www.last.fm/music/MxPx"">Read more on Last.fm</a>",658888,13790689,The Ataris
