Artista,Biografia,Listeners,Playcount,Artistas Similares
The Fad,"The Fad was a band from Long Island, NY that played a mix of punk, ska, and hardcore. Founded in 2000 under the name ""Death: 101"", the band originally consisted of Jimmy Doyle, Jay Beiner, Matt McGregor, and Dave Solomon of High School Football Heroes. Death: 101 broke up after Doyle left for college, however Doyle, McGregor, and Beiner soon reunited under the moniker ""The Fad"", adding Tom Malinowski on guitar. In 2004, they released their 8-song debut, ""Number 5"", after which Beiner and McGregor left the band to pursue college. <a href=""https://www.last.fm/music/The+Fad"">Read more on Last.fm</a>",23492,274805,High School Football Heroes
The B Sharps,"The b Sharps are a Ska/ Punk band that formed in the summer of 2005 in Riverside, CA that blend in the sexy vibes of Marvin Gaye with the smooth rhythms of Kenny G to create a sound that makes you want to get naked and start a love revolution. A super group like none other, drummer Joshua Hatfield, Guitarist Robert Lenfestey, Bassist Doug Boons, Trupitist Benny Sanchez, and Trombonist Kyle Kennedy take the newly created genre ""Sexy Ska"" to a whole <a href=""https://www.last.fm/music/The+B+Sharps"">Read more on Last.fm</a>",700,5953,Hooray for Our Side
Skatune Network,"Skatune Network is the YouTube channel and music project of Jermey Hunter (they/them), who takes all of your favorite songs and turns them into ska songs. Hunter also makes music under the name JER and plays trombone in We Are the Union. <a href=""https://www.last.fm/music/Skatune+Network"">Read more on Last.fm</a>",29423,543240,We Are the Union
Hub City Stompers,"Hub City Stompers hail from the ""hub city"" of New Brunswick, NJ. Formed in the summer of 2002 in the wasteland of the seemingly ""dead"" ska scene. These necromaniacs romanced ska's rotted corpse, playing for the love of the music rather than the popularity of it, and formed a force to be reckoned with in the New Jersey music scene.

Embracing various styles and eras from the 60's through the 80's, and adding reggae, jazz, punk and even classical influences <a href=""https://www.last.fm/music/Hub+City+Stompers"">Read more on Last.fm</a>",12330,231321,Inspecter 7
Roger Rivas,"Los Angeles born and raised Roger was surrounded by music . His father Roger Rivas Sr. was a crucial part in the ""Brown Sound"" of East L.A playing keyboards for the legendary group known as Tierra. At a very young age Roger Jr would be introduced to many musicians in the Los Angeles circuit. Members from WAR, Malo, El Chicano, Thee Midnigters and more. Much of Roger Jrs musical taste is owed to his father. A big testament to this was his introduction to L. <a href=""https://www.last.fm/music/Roger+Rivas"">Read more on Last.fm</a>",2369,21382,The Steady 45's
New York Ska-Jazz Ensemble,"New York Ska-Jazz Ensemble is a group of New York ska musicians linking together ska and jazz music. 

Members:
Freddie Reiter (saxophone, flute, vocals),Mark Paquin (trombone, vocals)
Yao Dinizulu (drums), Alberto Tarin (guitar), Earl Appleton (keyboards)

ADDITIONAL MUSICIANS

Mitch Margold (keyboards),Cary Brown (keyboards), Gregg Leventhal (bass)
Lee Archibald(guitar, bass, vocals), Chris Weigers (bass)

PAST MEMBERS

Johnnathan McCain (drums <a href=""https://www.last.fm/music/New+York+Ska-Jazz+Ensemble"">Read more on Last.fm</a>",74365,1197247,The Toasters
P.A.I.N,"Established in 1995, The Propaganda And Information Network (as P.A.I.N is officially named) was first put together from the ashes of two seminal free festival bands: AOS3 and Radical Dance Faction. Brought together to carry on the same Anarcho-style rantings, but with a much harder, Punk Rock attitude to it (less toking and more drinking!) within the first 7 days of forming P.A.I.N managed to book up a 3 week tour, literally writing the set in soundchecks.  <a href=""https://www.last.fm/music/+noredirect/P.A.I.N"">Read more on Last.fm</a>",440,6638,no data
Chris Murray Combo,"Chris Murray Combo is an acoustic based trio featuring Ben Farrar on drums and backing vocals, Eddie “Chiquis” Lozoya on bass and backing vocals, and Chris Murray on acoustic guitar and lead vocals. Combining elements of ska, reggae and folk music, CMC creates a sound that is both fresh and roots.

Since 2003, CMC has been the host band at Bluebeat Lounge, the world’s longest running weekly ska/reggae concert series, at Knitting Factory in Hollywood. <a href=""https://www.last.fm/music/Chris+Murray+Combo"">Read more on Last.fm</a>",3925,49412,Chris Murray
Link 80,"Link 80 was a punk rock/ska punk band from the San Francisco Bay Area.

Link 80 started in early 1994 in the famous East Bay of California. In the beginning, original members (guitarist Matt Bettinelli-Olpin, drummer Joey Bustos, bassist Adam Pereria and singer Jeff Acree) played around town as Drano, The Rag-Tags, and Mr. Slave-Unit, before settling on Link 80.

The name came from the interstate highway I-80 which they used to get to the drummer's garage for band practice and connected the band members' homes. <a href=""https://www.last.fm/music/Link+80"">Read more on Last.fm</a>",52130,517471,Assorted Jelly Beans
The Rude Monkey Bones," <a href=""https://www.last.fm/music/The+Rude+Monkey+Bones"">Read more on Last.fm</a>",328,1745,Quito Ska Jazz
